"No.","Time","Source","Destination","Protocol","Length","Info"
"2","0.483932140","192.168.1.68","178.135.6.12","TCP","66","40442  >  443 [ACK] Seq=1 Ack=1 Win=450 Len=0 TSval=1967934203 TSecr=849739781"
"3","0.506424316","178.135.6.12","192.168.1.68","TCP","66","[TCP ACKed unseen segment] 443  >  40442 [ACK] Seq=1 Ack=2 Win=22 Len=0 TSval=849750021 TSecr=1967913793"
"4","2.371613318","192.168.1.68","172.217.19.142","TLSv1.2","634","Application Data"
"5","2.401151781","172.217.19.142","192.168.1.68","TCP","66","443  >  40176 [ACK] Seq=1 Ack=569 Win=24 Len=0 TSval=849751915 TSecr=1507313609"
"6","2.403218175","192.168.1.68","178.135.6.13","TLSv1.2","1360","Application Data"
"7","2.437920353","178.135.6.13","192.168.1.68","TCP","66","443  >  38900 [ACK] Seq=1 Ack=1295 Win=22 Len=0 TSval=849751952 TSecr=2938439097"
"8","2.440718055","178.135.6.13","192.168.1.68","TLSv1.2","1506","Application Data"
"9","2.440747877","192.168.1.68","178.135.6.13","TCP","66","38900  >  443 [ACK] Seq=1295 Ack=1441 Win=494 Len=0 TSval=2938439135 TSecr=849751953"
"10","2.442597764","178.135.6.13","192.168.1.68","TCP","1506","443  >  38900 [PSH, ACK] Seq=1441 Ack=1295 Win=22 Len=1440 TSval=849751953 TSecr=2938439097 [TCP segment of a reassembled PDU]"
"11","2.442613967","192.168.1.68","178.135.6.13","TCP","66","38900  >  443 [ACK] Seq=1295 Ack=2881 Win=493 Len=0 TSval=2938439136 TSecr=849751953"
"12","2.443008291","178.135.6.13","192.168.1.68","TCP","389","443  >  38900 [PSH, ACK] Seq=2881 Ack=1295 Win=22 Len=323 TSval=849751953 TSecr=2938439097 [TCP segment of a reassembled PDU]"
"13","2.443018906","192.168.1.68","178.135.6.13","TCP","66","38900  >  443 [ACK] Seq=1295 Ack=3204 Win=493 Len=0 TSval=2938439137 TSecr=849751953"
"14","2.463271063","172.217.19.142","192.168.1.68","TLSv1.2","133","Application Data"
"15","2.463367025","172.217.19.142","192.168.1.68","TLSv1.2","97","Application Data"
"16","2.463815126","172.217.19.142","192.168.1.68","TLSv1.2","105","Application Data"
"17","2.464095888","192.168.1.68","172.217.19.142","TCP","66","40176  >  443 [ACK] Seq=569 Ack=138 Win=226 Len=0 TSval=1507313702 TSecr=849751977"
"18","2.464213711","192.168.1.68","172.217.19.142","TLSv1.2","105","Application Data"
"19","2.465507939","178.135.6.13","192.168.1.68","TCP","1183","443  >  38900 [ACK] Seq=3204 Ack=1295 Win=22 Len=1117 TSval=849751978 TSecr=2938439135 [TCP segment of a reassembled PDU]"
"20","2.465546562","192.168.1.68","178.135.6.13","TCP","66","38900  >  443 [ACK] Seq=1295 Ack=4321 Win=492 Len=0 TSval=2938439159 TSecr=849751978"
"21","2.467114289","178.135.6.13","192.168.1.68","TCP","1506","443  >  38900 [PSH, ACK] Seq=4321 Ack=1295 Win=22 Len=1440 TSval=849751978 TSecr=2938439135 [TCP segment of a reassembled PDU]"
"22","2.467159756","192.168.1.68","178.135.6.13","TCP","66","38900  >  443 [ACK] Seq=1295 Ack=5761 Win=491 Len=0 TSval=2938439161 TSecr=849751978"
"23","2.469025426","178.135.6.13","192.168.1.68","TCP","1506","443  >  38900 [ACK] Seq=5761 Ack=1295 Win=22 Len=1440 TSval=849751980 TSecr=2938439137 [TCP segment of a reassembled PDU]"
"24","2.469069007","192.168.1.68","178.135.6.13","TCP","66","38900  >  443 [ACK] Seq=1295 Ack=7201 Win=491 Len=0 TSval=2938439163 TSecr=849751980"
"25","2.470950321","178.135.6.13","192.168.1.68","TCP","1506","443  >  38900 [PSH, ACK] Seq=7201 Ack=1295 Win=22 Len=1440 TSval=849751980 TSecr=2938439137 [TCP segment of a reassembled PDU]"
"26","2.470993134","192.168.1.68","178.135.6.13","TCP","66","38900  >  443 [ACK] Seq=1295 Ack=8641 Win=491 Len=0 TSval=2938439165 TSecr=849751980"
"27","2.490678738","178.135.6.13","192.168.1.68","TCP","1506","443  >  38900 [ACK] Seq=8641 Ack=1295 Win=22 Len=1440 TSval=849752003 TSecr=2938439159 [TCP segment of a reassembled PDU]"
"28","2.490716383","192.168.1.68","178.135.6.13","TCP","66","38900  >  443 [ACK] Seq=1295 Ack=10081 Win=491 Len=0 TSval=2938439184 TSecr=849752003"
"29","2.491933995","178.135.6.13","192.168.1.68","TCP","1506","443  >  38900 [PSH, ACK] Seq=10081 Ack=1295 Win=22 Len=1440 TSval=849752003 TSecr=2938439159 [TCP segment of a reassembled PDU]"
"30","2.491959767","192.168.1.68","178.135.6.13","TCP","66","38900  >  443 [ACK] Seq=1295 Ack=11521 Win=491 Len=0 TSval=2938439186 TSecr=849752003"
"31","2.492038967","172.217.19.142","192.168.1.68","TCP","66","443  >  40176 [ACK] Seq=138 Ack=608 Win=24 Len=0 TSval=849752003 TSecr=1507313702"
"32","2.493875653","178.135.6.13","192.168.1.68","TCP","1506","443  >  38900 [ACK] Seq=11521 Ack=1295 Win=22 Len=1440 TSval=849752004 TSecr=2938439161 [TCP segment of a reassembled PDU]"
"33","2.493894580","192.168.1.68","178.135.6.13","TCP","66","38900  >  443 [ACK] Seq=1295 Ack=12961 Win=491 Len=0 TSval=2938439188 TSecr=849752004"
"34","2.495342250","178.135.6.13","192.168.1.68","TCP","1506","443  >  38900 [PSH, ACK] Seq=12961 Ack=1295 Win=22 Len=1440 TSval=849752004 TSecr=2938439161 [TCP segment of a reassembled PDU]"
"35","2.495379406","192.168.1.68","178.135.6.13","TCP","66","38900  >  443 [ACK] Seq=1295 Ack=14401 Win=491 Len=0 TSval=2938439189 TSecr=849752004"
"36","2.497464028","178.135.6.13","192.168.1.68","TCP","1506","443  >  38900 [ACK] Seq=14401 Ack=1295 Win=22 Len=1440 TSval=849752006 TSecr=2938439163 [TCP segment of a reassembled PDU]"
"37","2.497501393","192.168.1.68","178.135.6.13","TCP","66","38900  >  443 [ACK] Seq=1295 Ack=15841 Win=491 Len=0 TSval=2938439191 TSecr=849752006"
"38","2.499292683","178.135.6.13","192.168.1.68","TCP","1506","443  >  38900 [PSH, ACK] Seq=15841 Ack=1295 Win=22 Len=1440 TSval=849752006 TSecr=2938439163 [TCP segment of a reassembled PDU]"
"39","2.499329629","192.168.1.68","178.135.6.13","TCP","66","38900  >  443 [ACK] Seq=1295 Ack=17281 Win=491 Len=0 TSval=2938439193 TSecr=849752006"
"40","2.500759140","178.135.6.13","192.168.1.68","TLSv1.2","1506","Application Data [TCP segment of a reassembled PDU]"
"41","2.500792873","192.168.1.68","178.135.6.13","TCP","66","38900  >  443 [ACK] Seq=1295 Ack=18721 Win=491 Len=0 TSval=2938439195 TSecr=849752008"
"42","2.502687598","178.135.6.13","192.168.1.68","TCP","1506","443  >  38900 [PSH, ACK] Seq=18721 Ack=1295 Win=22 Len=1440 TSval=849752008 TSecr=2938439165 [TCP segment of a reassembled PDU]"
"43","2.502722309","192.168.1.68","178.135.6.13","TCP","66","38900  >  443 [ACK] Seq=1295 Ack=20161 Win=491 Len=0 TSval=2938439196 TSecr=849752008"
"44","2.516496267","178.135.6.13","192.168.1.68","TCP","1506","443  >  38900 [ACK] Seq=20161 Ack=1295 Win=22 Len=1440 TSval=849752029 TSecr=2938439186 [TCP segment of a reassembled PDU]"
"45","2.516535657","192.168.1.68","178.135.6.13","TCP","66","38900  >  443 [ACK] Seq=1295 Ack=21601 Win=491 Len=0 TSval=2938439210 TSecr=849752029"
"46","2.518447632","178.135.6.13","192.168.1.68","TCP","1506","443  >  38900 [ACK] Seq=21601 Ack=1295 Win=22 Len=1440 TSval=849752029 TSecr=2938439186 [TCP segment of a reassembled PDU]"
"47","2.520466674","178.135.6.13","192.168.1.68","TCP","1506","443  >  38900 [ACK] Seq=23041 Ack=1295 Win=22 Len=1440 TSval=849752029 TSecr=2938439186 [TCP segment of a reassembled PDU]"
"48","2.520496985","192.168.1.68","178.135.6.13","TCP","66","38900  >  443 [ACK] Seq=1295 Ack=24481 Win=491 Len=0 TSval=2938439214 TSecr=849752029"
"49","2.521959462","178.135.6.13","192.168.1.68","TCP","1506","443  >  38900 [PSH, ACK] Seq=24481 Ack=1295 Win=22 Len=1440 TSval=849752029 TSecr=2938439186 [TCP segment of a reassembled PDU]"
"50","2.524005322","178.135.6.13","192.168.1.68","TCP","1506","443  >  38900 [ACK] Seq=25921 Ack=1295 Win=22 Len=1440 TSval=849752031 TSecr=2938439188 [TCP segment of a reassembled PDU]"
"51","2.524029627","192.168.1.68","178.135.6.13","TCP","66","38900  >  443 [ACK] Seq=1295 Ack=27361 Win=491 Len=0 TSval=2938439218 TSecr=849752029"
"52","2.525869596","178.135.6.13","192.168.1.68","TCP","1506","443  >  38900 [PSH, ACK] Seq=27361 Ack=1295 Win=22 Len=1440 TSval=849752031 TSecr=2938439188 [TCP segment of a reassembled PDU]"
"53","2.527354910","178.135.6.13","192.168.1.68","TCP","1506","443  >  38900 [ACK] Seq=28801 Ack=1295 Win=22 Len=1440 TSval=849752033 TSecr=2938439189 [TCP segment of a reassembled PDU]"
"54","2.527387247","192.168.1.68","178.135.6.13","TCP","66","38900  >  443 [ACK] Seq=1295 Ack=30241 Win=491 Len=0 TSval=2938439221 TSecr=849752031"
"55","2.529314168","178.135.6.13","192.168.1.68","TCP","1506","443  >  38900 [PSH, ACK] Seq=30241 Ack=1295 Win=22 Len=1440 TSval=849752033 TSecr=2938439189 [TCP segment of a reassembled PDU]"
"56","2.531317076","178.135.6.13","192.168.1.68","TCP","1506","443  >  38900 [ACK] Seq=31681 Ack=1295 Win=22 Len=1440 TSval=849752035 TSecr=2938439191 [TCP segment of a reassembled PDU]"
"57","2.531356397","192.168.1.68","178.135.6.13","TCP","66","38900  >  443 [ACK] Seq=1295 Ack=33121 Win=491 Len=0 TSval=2938439225 TSecr=849752033"
"58","2.532750010","178.135.6.13","192.168.1.68","TLSv1.2","1506","Application Data [TCP segment of a reassembled PDU]"
"59","2.534709826","178.135.6.13","192.168.1.68","TCP","1506","443  >  38900 [ACK] Seq=34561 Ack=1295 Win=22 Len=1440 TSval=849752037 TSecr=2938439193 [TCP segment of a reassembled PDU]"
"60","2.534745166","192.168.1.68","178.135.6.13","TCP","66","38900  >  443 [ACK] Seq=1295 Ack=36001 Win=491 Len=0 TSval=2938439229 TSecr=849752035"
"61","2.536201077","178.135.6.13","192.168.1.68","TCP","1506","443  >  38900 [PSH, ACK] Seq=36001 Ack=1295 Win=22 Len=1440 TSval=849752037 TSecr=2938439193 [TCP segment of a reassembled PDU]"
"62","2.538236392","178.135.6.13","192.168.1.68","TCP","1506","443  >  38900 [ACK] Seq=37441 Ack=1295 Win=22 Len=1440 TSval=849752038 TSecr=2938439195 [TCP segment of a reassembled PDU]"
"63","2.538279903","192.168.1.68","178.135.6.13","TCP","66","38900  >  443 [ACK] Seq=1295 Ack=38881 Win=491 Len=0 TSval=2938439232 TSecr=849752037"
"64","2.540462862","178.135.6.13","192.168.1.68","TCP","1506","443  >  38900 [PSH, ACK] Seq=38881 Ack=1295 Win=22 Len=1440 TSval=849752038 TSecr=2938439195 [TCP segment of a reassembled PDU]"
"65","2.541658335","178.135.6.13","192.168.1.68","TCP","1506","443  >  38900 [ACK] Seq=40321 Ack=1295 Win=22 Len=1440 TSval=849752040 TSecr=2938439196 [TCP segment of a reassembled PDU]"
"66","2.541680475","192.168.1.68","178.135.6.13","TCP","66","38900  >  443 [ACK] Seq=1295 Ack=41761 Win=491 Len=0 TSval=2938439235 TSecr=849752038"
"67","2.543624158","178.135.6.13","192.168.1.68","TCP","1506","443  >  38900 [PSH, ACK] Seq=41761 Ack=1295 Win=22 Len=1440 TSval=849752040 TSecr=2938439196 [TCP segment of a reassembled PDU]"
"68","2.545579365","178.135.6.13","192.168.1.68","TCP","1506","443  >  38900 [ACK] Seq=43201 Ack=1295 Win=22 Len=1440 TSval=849752053 TSecr=2938439210 [TCP segment of a reassembled PDU]"
"69","2.545593263","192.168.1.68","178.135.6.13","TCP","66","38900  >  443 [ACK] Seq=1295 Ack=44641 Win=491 Len=0 TSval=2938439239 TSecr=849752040"
"70","2.547064470","178.135.6.13","192.168.1.68","TCP","1506","443  >  38900 [PSH, ACK] Seq=44641 Ack=1295 Win=22 Len=1440 TSval=849752053 TSecr=2938439210 [TCP segment of a reassembled PDU]"
"71","2.549124648","178.135.6.13","192.168.1.68","TCP","1506","443  >  38900 [ACK] Seq=46081 Ack=1295 Win=22 Len=1440 TSval=849752057 TSecr=2938439214 [TCP segment of a reassembled PDU]"
"72","2.549164597","192.168.1.68","178.135.6.13","TCP","66","38900  >  443 [ACK] Seq=1295 Ack=47521 Win=491 Len=0 TSval=2938439243 TSecr=849752053"
"73","2.551016509","178.135.6.13","192.168.1.68","TCP","1506","443  >  38900 [PSH, ACK] Seq=47521 Ack=1295 Win=22 Len=1440 TSval=849752057 TSecr=2938439214 [TCP segment of a reassembled PDU]"
"74","2.552548547","178.135.6.13","192.168.1.68","TLSv1.2","1506","Application Data [TCP segment of a reassembled PDU]"
"75","2.552570826","192.168.1.68","178.135.6.13","TCP","66","38900  >  443 [ACK] Seq=1295 Ack=50401 Win=491 Len=0 TSval=2938439246 TSecr=849752057"
"76","2.554449697","178.135.6.13","192.168.1.68","TCP","1282","443  >  38900 [PSH, ACK] Seq=50401 Ack=1295 Win=22 Len=1216 TSval=849752061 TSecr=2938439218 [TCP segment of a reassembled PDU]"
"77","2.554552643","192.168.1.68","178.135.6.13","TCP","66","38900  >  443 [ACK] Seq=1295 Ack=51617 Win=495 Len=0 TSval=2938439248 TSecr=849752061"
"78","2.556043265","178.135.6.13","192.168.1.68","TCP","1506","443  >  38900 [ACK] Seq=51617 Ack=1295 Win=22 Len=1440 TSval=849752065 TSecr=2938439221 [TCP segment of a reassembled PDU]"
"79","2.559139888","178.135.6.13","192.168.1.68","TCP","1506","443  >  38900 [PSH, ACK] Seq=53057 Ack=1295 Win=22 Len=1440 TSval=849752065 TSecr=2938439221 [TCP segment of a reassembled PDU]"
"80","2.559244580","192.168.1.68","178.135.6.13","TCP","66","38900  >  443 [ACK] Seq=1295 Ack=54497 Win=495 Len=0 TSval=2938439253 TSecr=849752065"
"81","2.560176263","178.135.6.13","192.168.1.68","TCP","1506","443  >  38900 [ACK] Seq=54497 Ack=1295 Win=22 Len=1440 TSval=849752068 TSecr=2938439225 [TCP segment of a reassembled PDU]"
"82","2.562061558","178.135.6.13","192.168.1.68","TCP","1506","443  >  38900 [PSH, ACK] Seq=55937 Ack=1295 Win=22 Len=1440 TSval=849752068 TSecr=2938439225 [TCP segment of a reassembled PDU]"
"83","2.562210181","192.168.1.68","178.135.6.13","TCP","66","38900  >  443 [ACK] Seq=1295 Ack=57377 Win=495 Len=0 TSval=2938439256 TSecr=849752068"
"84","2.563330016","178.135.6.13","192.168.1.68","TCP","1506","443  >  38900 [ACK] Seq=57377 Ack=1295 Win=22 Len=1440 TSval=849752072 TSecr=2938439229 [TCP segment of a reassembled PDU]"
"85","2.565354296","178.135.6.13","192.168.1.68","TCP","1506","443  >  38900 [PSH, ACK] Seq=58817 Ack=1295 Win=22 Len=1440 TSval=849752072 TSecr=2938439229 [TCP segment of a reassembled PDU]"
"86","2.565480708","192.168.1.68","178.135.6.13","TCP","66","38900  >  443 [ACK] Seq=1295 Ack=60257 Win=495 Len=0 TSval=2938439259 TSecr=849752072"
"87","2.566775217","178.135.6.13","192.168.1.68","TCP","1506","443  >  38900 [ACK] Seq=60257 Ack=1295 Win=22 Len=1440 TSval=849752076 TSecr=2938439232 [TCP segment of a reassembled PDU]"
"88","2.568719249","178.135.6.13","192.168.1.68","TCP","1506","443  >  38900 [PSH, ACK] Seq=61697 Ack=1295 Win=22 Len=1440 TSval=849752076 TSecr=2938439232 [TCP segment of a reassembled PDU]"
"89","2.568830715","192.168.1.68","178.135.6.13","TCP","66","38900  >  443 [ACK] Seq=1295 Ack=63137 Win=495 Len=0 TSval=2938439263 TSecr=849752076"
"90","2.570971630","178.135.6.13","192.168.1.68","TCP","1506","443  >  38900 [ACK] Seq=63137 Ack=1295 Win=22 Len=1440 TSval=849752077 TSecr=2938439235 [TCP segment of a reassembled PDU]"
"91","2.572194970","178.135.6.13","192.168.1.68","TCP","1506","443  >  38900 [PSH, ACK] Seq=64577 Ack=1295 Win=22 Len=1440 TSval=849752077 TSecr=2938439235 [TCP segment of a reassembled PDU]"
"92","2.572306576","192.168.1.68","178.135.6.13","TCP","66","38900  >  443 [ACK] Seq=1295 Ack=66017 Win=495 Len=0 TSval=2938439266 TSecr=849752077"
"93","2.574389872","178.135.6.13","192.168.1.68","TLSv1.2","1506","Application Data [TCP segment of a reassembled PDU]"
"94","2.576377066","178.135.6.13","192.168.1.68","TCP","1506","443  >  38900 [PSH, ACK] Seq=67457 Ack=1295 Win=22 Len=1440 TSval=849752082 TSecr=2938439239 [TCP segment of a reassembled PDU]"
"95","2.577922514","178.135.6.13","192.168.1.68","TCP","1506","443  >  38900 [ACK] Seq=68897 Ack=1295 Win=22 Len=1440 TSval=849752085 TSecr=2938439243 [TCP segment of a reassembled PDU]"
"96","2.578125263","192.168.1.68","178.135.6.13","TCP","66","38900  >  443 [ACK] Seq=1295 Ack=70337 Win=495 Len=0 TSval=2938439272 TSecr=849752082"
"97","2.579843149","178.135.6.13","192.168.1.68","TCP","1506","443  >  38900 [ACK] Seq=70337 Ack=1295 Win=22 Len=1440 TSval=849752085 TSecr=2938439243 [TCP segment of a reassembled PDU]"
"98","2.581655531","178.135.6.13","192.168.1.68","TCP","1506","443  >  38900 [PSH, ACK] Seq=71777 Ack=1295 Win=22 Len=1440 TSval=849752085 TSecr=2938439243 [TCP segment of a reassembled PDU]"
"99","2.581730959","192.168.1.68","178.135.6.13","TCP","66","38900  >  443 [ACK] Seq=1295 Ack=73217 Win=495 Len=0 TSval=2938439276 TSecr=849752085"
"100","2.585426681","178.135.6.13","192.168.1.68","TCP","1506","443  >  38900 [ACK] Seq=73217 Ack=1295 Win=22 Len=1440 TSval=849752089 TSecr=2938439246 [TCP segment of a reassembled PDU]"
"101","2.585740198","178.135.6.13","192.168.1.68","TCP","1506","443  >  38900 [PSH, ACK] Seq=74657 Ack=1295 Win=22 Len=1440 TSval=849752089 TSecr=2938439246 [TCP segment of a reassembled PDU]"
"102","2.585795303","192.168.1.68","178.135.6.13","TCP","66","38900  >  443 [ACK] Seq=1295 Ack=76097 Win=495 Len=0 TSval=2938439280 TSecr=849752089"
"103","2.586933506","178.135.6.13","192.168.1.68","TCP","1506","443  >  38900 [PSH, ACK] Seq=76097 Ack=1295 Win=22 Len=1440 TSval=849752091 TSecr=2938439248 [TCP segment of a reassembled PDU]"
"104","2.591816599","178.135.6.13","192.168.1.68","TCP","1506","443  >  38900 [ACK] Seq=77537 Ack=1295 Win=22 Len=1440 TSval=849752096 TSecr=2938439253 [TCP segment of a reassembled PDU]"
"105","2.592069774","192.168.1.68","178.135.6.13","TCP","66","38900  >  443 [ACK] Seq=1295 Ack=78977 Win=495 Len=0 TSval=2938439286 TSecr=849752091"
"106","2.592089888","178.135.6.13","192.168.1.68","TCP","1506","443  >  38900 [PSH, ACK] Seq=78977 Ack=1295 Win=22 Len=1440 TSval=849752096 TSecr=2938439253 [TCP segment of a reassembled PDU]"
"107","2.592681584","178.135.6.13","192.168.1.68","TCP","1506","443  >  38900 [ACK] Seq=80417 Ack=1295 Win=22 Len=1440 TSval=849752098 TSecr=2938439256 [TCP segment of a reassembled PDU]"
"108","2.592800034","192.168.1.68","178.135.6.13","TCP","66","38900  >  443 [ACK] Seq=1295 Ack=81857 Win=495 Len=0 TSval=2938439287 TSecr=849752096"
"109","2.594113120","178.135.6.13","192.168.1.68","TLSv1.2","1506","Application Data [TCP segment of a reassembled PDU]"
"110","2.596198511","178.135.6.13","192.168.1.68","TCP","1506","443  >  38900 [ACK] Seq=83297 Ack=1295 Win=22 Len=1440 TSval=849752102 TSecr=2938439259 [TCP segment of a reassembled PDU]"
"111","2.596319267","192.168.1.68","178.135.6.13","TCP","66","38900  >  443 [ACK] Seq=1295 Ack=84737 Win=495 Len=0 TSval=2938439290 TSecr=849752098"
"112","2.598072772","178.135.6.13","192.168.1.68","TCP","1506","443  >  38900 [PSH, ACK] Seq=84737 Ack=1295 Win=22 Len=1440 TSval=849752102 TSecr=2938439259 [TCP segment of a reassembled PDU]"
"113","2.599581833","178.135.6.13","192.168.1.68","TCP","1506","443  >  38900 [ACK] Seq=86177 Ack=1295 Win=22 Len=1440 TSval=849752106 TSecr=2938439263 [TCP segment of a reassembled PDU]"
"114","2.599654887","192.168.1.68","178.135.6.13","TCP","66","38900  >  443 [ACK] Seq=1295 Ack=87617 Win=495 Len=0 TSval=2938439293 TSecr=849752102"
"115","2.601252087","178.135.6.13","192.168.1.68","TCP","1506","443  >  38900 [PSH, ACK] Seq=87617 Ack=1295 Win=22 Len=1440 TSval=849752106 TSecr=2938439263 [TCP segment of a reassembled PDU]"
"116","2.603213021","178.135.6.13","192.168.1.68","TCP","1506","443  >  38900 [ACK] Seq=89057 Ack=1295 Win=22 Len=1440 TSval=849752109 TSecr=2938439266 [TCP segment of a reassembled PDU]"
"117","2.604039103","192.168.1.68","178.135.6.13","TCP","66","38900  >  443 [ACK] Seq=1295 Ack=90497 Win=495 Len=0 TSval=2938439298 TSecr=849752106"
"118","2.604700011","178.135.6.13","192.168.1.68","TCP","1506","443  >  38900 [PSH, ACK] Seq=90497 Ack=1295 Win=22 Len=1440 TSval=849752109 TSecr=2938439266 [TCP segment of a reassembled PDU]"
"119","2.606792247","178.135.6.13","192.168.1.68","TCP","1506","443  >  38900 [ACK] Seq=91937 Ack=1295 Win=22 Len=1440 TSval=849752115 TSecr=2938439272 [TCP segment of a reassembled PDU]"
"120","2.606864253","192.168.1.68","178.135.6.13","TCP","66","38900  >  443 [ACK] Seq=1295 Ack=93377 Win=495 Len=0 TSval=2938439301 TSecr=849752109"
"121","2.608896076","178.135.6.13","192.168.1.68","TCP","1506","443  >  38900 [ACK] Seq=93377 Ack=1295 Win=22 Len=1440 TSval=849752115 TSecr=2938439272 [TCP segment of a reassembled PDU]"
"122","2.610318324","178.135.6.13","192.168.1.68","TCP","1506","443  >  38900 [PSH, ACK] Seq=94817 Ack=1295 Win=22 Len=1440 TSval=849752115 TSecr=2938439272 [TCP segment of a reassembled PDU]"
"123","2.610380762","192.168.1.68","178.135.6.13","TCP","66","38900  >  443 [ACK] Seq=1295 Ack=96257 Win=495 Len=0 TSval=2938439304 TSecr=849752115"
"124","2.612325841","178.135.6.13","192.168.1.68","TCP","1506","443  >  38900 [ACK] Seq=96257 Ack=1295 Win=22 Len=1440 TSval=849752119 TSecr=2938439276 [TCP segment of a reassembled PDU]"
"125","2.614371981","178.135.6.13","192.168.1.68","TCP","1506","443  >  38900 [ACK] Seq=97697 Ack=1295 Win=22 Len=1440 TSval=849752119 TSecr=2938439276 [TCP segment of a reassembled PDU]"
"126","2.614518369","192.168.1.68","178.135.6.13","TCP","66","38900  >  443 [ACK] Seq=1295 Ack=99137 Win=495 Len=0 TSval=2938439308 TSecr=849752119"
"127","2.615816788","178.135.6.13","192.168.1.68","TLSv1.2","1506","Application Data [TCP segment of a reassembled PDU]"
"128","2.616107328","178.135.6.13","192.168.1.68","TCP","98","443  >  38900 [PSH, ACK] Seq=100577 Ack=1295 Win=22 Len=32 TSval=849752119 TSecr=2938439276 [TCP segment of a reassembled PDU]"
"129","2.616741068","192.168.1.68","178.135.6.13","TCP","66","38900  >  443 [ACK] Seq=1295 Ack=100609 Win=494 Len=0 TSval=2938439311 TSecr=849752119"
"130","2.617859436","178.135.6.13","192.168.1.68","TCP","1506","443  >  38900 [ACK] Seq=100609 Ack=1295 Win=22 Len=1440 TSval=849752123 TSecr=2938439280 [TCP segment of a reassembled PDU]"
"131","2.619596040","178.135.6.13","192.168.1.68","TCP","1506","443  >  38900 [PSH, ACK] Seq=102049 Ack=1295 Win=22 Len=1440 TSval=849752123 TSecr=2938439280 [TCP segment of a reassembled PDU]"
"132","2.619674821","192.168.1.68","178.135.6.13","TCP","66","38900  >  443 [ACK] Seq=1295 Ack=103489 Win=495 Len=0 TSval=2938439313 TSecr=849752123"
"133","2.621457589","178.135.6.13","192.168.1.68","TCP","1506","443  >  38900 [ACK] Seq=103489 Ack=1295 Win=22 Len=1440 TSval=849752128 TSecr=2938439286 [TCP segment of a reassembled PDU]"
"134","2.623011767","178.135.6.13","192.168.1.68","TCP","1506","443  >  38900 [PSH, ACK] Seq=104929 Ack=1295 Win=22 Len=1440 TSval=849752128 TSecr=2938439286 [TCP segment of a reassembled PDU]"
"135","2.623078466","192.168.1.68","178.135.6.13","TCP","66","38900  >  443 [ACK] Seq=1295 Ack=106369 Win=495 Len=0 TSval=2938439317 TSecr=849752128"
"136","2.625154358","178.135.6.13","192.168.1.68","TCP","1506","443  >  38900 [ACK] Seq=106369 Ack=1295 Win=22 Len=1440 TSval=849752130 TSecr=2938439287 [TCP segment of a reassembled PDU]"
"137","2.627191698","178.135.6.13","192.168.1.68","TCP","1506","443  >  38900 [PSH, ACK] Seq=107809 Ack=1295 Win=22 Len=1440 TSval=849752130 TSecr=2938439287 [TCP segment of a reassembled PDU]"
"138","2.627727032","192.168.1.68","178.135.6.13","TCP","66","38900  >  443 [ACK] Seq=1295 Ack=109249 Win=495 Len=0 TSval=2938439321 TSecr=849752130"
"139","2.628639229","178.135.6.13","192.168.1.68","TCP","1506","443  >  38900 [ACK] Seq=109249 Ack=1295 Win=22 Len=1440 TSval=849752134 TSecr=2938439290 [TCP segment of a reassembled PDU]"
"140","2.630682296","178.135.6.13","192.168.1.68","TCP","1506","443  >  38900 [PSH, ACK] Seq=110689 Ack=1295 Win=22 Len=1440 TSval=849752134 TSecr=2938439290 [TCP segment of a reassembled PDU]"
"141","2.631719299","192.168.1.68","178.135.6.13","TCP","66","38900  >  443 [ACK] Seq=1295 Ack=112129 Win=495 Len=0 TSval=2938439325 TSecr=849752134"
"142","2.632629820","178.135.6.13","192.168.1.68","TCP","1506","443  >  38900 [ACK] Seq=112129 Ack=1295 Win=22 Len=1440 TSval=849752136 TSecr=2938439293 [TCP segment of a reassembled PDU]"
"143","2.634172125","178.135.6.13","192.168.1.68","TCP","1474","443  >  38900 [PSH, ACK] Seq=113569 Ack=1295 Win=22 Len=1408 TSval=849752136 TSecr=2938439293 [TCP segment of a reassembled PDU]"
"144","2.635070773","192.168.1.68","178.135.6.13","TCP","66","38900  >  443 [ACK] Seq=1295 Ack=114977 Win=495 Len=0 TSval=2938439329 TSecr=849752136"
"145","2.636064405","178.135.6.13","192.168.1.68","TLSv1.2","1506","Application Data [TCP segment of a reassembled PDU]"
"146","2.638153078","178.135.6.13","192.168.1.68","TCP","1506","443  >  38900 [PSH, ACK] Seq=116417 Ack=1295 Win=22 Len=1440 TSval=849752141 TSecr=2938439298 [TCP segment of a reassembled PDU]"
"147","2.638280608","192.168.1.68","178.135.6.13","TCP","66","38900  >  443 [ACK] Seq=1295 Ack=117857 Win=495 Len=0 TSval=2938439332 TSecr=849752141"
"148","2.639258317","178.135.6.13","192.168.1.68","TCP","1506","443  >  38900 [ACK] Seq=117857 Ack=1295 Win=22 Len=1440 TSval=849752143 TSecr=2938439301 [TCP segment of a reassembled PDU]"
"149","2.641404888","178.135.6.13","192.168.1.68","TCP","1506","443  >  38900 [PSH, ACK] Seq=119297 Ack=1295 Win=22 Len=1440 TSval=849752143 TSecr=2938439301 [TCP segment of a reassembled PDU]"
"150","2.641456501","192.168.1.68","178.135.6.13","TCP","66","38900  >  443 [ACK] Seq=1295 Ack=120737 Win=495 Len=0 TSval=2938439335 TSecr=849752143"
"151","2.641859206","178.135.6.13","192.168.1.68","TCP","389","443  >  38900 [PSH, ACK] Seq=120737 Ack=1295 Win=22 Len=323 TSval=849752144 TSecr=2938439301 [TCP segment of a reassembled PDU]"
"152","2.641919339","192.168.1.68","178.135.6.13","TCP","66","38900  >  443 [ACK] Seq=1295 Ack=121060 Win=495 Len=0 TSval=2938439336 TSecr=849752144"
"153","2.643932654","178.135.6.13","192.168.1.68","TCP","1506","443  >  38900 [ACK] Seq=121060 Ack=1295 Win=22 Len=1440 TSval=849752147 TSecr=2938439304 [TCP segment of a reassembled PDU]"
"154","2.645334578","178.135.6.13","192.168.1.68","TCP","1183","443  >  38900 [PSH, ACK] Seq=122500 Ack=1295 Win=22 Len=1117 TSval=849752147 TSecr=2938439304 [TCP segment of a reassembled PDU]"
"155","2.645385562","192.168.1.68","178.135.6.13","TCP","66","38900  >  443 [ACK] Seq=1295 Ack=123617 Win=495 Len=0 TSval=2938439339 TSecr=849752147"
"156","2.646945467","178.135.6.13","192.168.1.68","TCP","1506","443  >  38900 [ACK] Seq=123617 Ack=1295 Win=22 Len=1440 TSval=849752151 TSecr=2938439308 [TCP segment of a reassembled PDU]"
"157","2.648900325","178.135.6.13","192.168.1.68","TCP","1506","443  >  38900 [PSH, ACK] Seq=125057 Ack=1295 Win=22 Len=1440 TSval=849752151 TSecr=2938439308 [TCP segment of a reassembled PDU]"
"158","2.648938947","192.168.1.68","178.135.6.13","TCP","66","38900  >  443 [ACK] Seq=1295 Ack=126497 Win=495 Len=0 TSval=2938439343 TSecr=849752151"
"159","2.650787017","178.135.6.13","192.168.1.68","TCP","1506","443  >  38900 [ACK] Seq=126497 Ack=1295 Win=22 Len=1440 TSval=849752153 TSecr=2938439311 [TCP segment of a reassembled PDU]"
"160","2.652391202","178.135.6.13","192.168.1.68","TCP","1506","443  >  38900 [PSH, ACK] Seq=127937 Ack=1295 Win=22 Len=1440 TSval=849752153 TSecr=2938439311 [TCP segment of a reassembled PDU]"
"161","2.652446586","192.168.1.68","178.135.6.13","TCP","66","38900  >  443 [ACK] Seq=1295 Ack=129377 Win=495 Len=0 TSval=2938439346 TSecr=849752153"
"162","2.654239900","178.135.6.13","192.168.1.68","TCP","1506","443  >  38900 [ACK] Seq=129377 Ack=1295 Win=22 Len=1440 TSval=849752156 TSecr=2938439313 [TCP segment of a reassembled PDU]"
"163","2.656271234","178.135.6.13","192.168.1.68","TCP","1506","443  >  38900 [PSH, ACK] Seq=130817 Ack=1295 Win=22 Len=1440 TSval=849752156 TSecr=2938439313 [TCP segment of a reassembled PDU]"
"164","2.656335977","192.168.1.68","178.135.6.13","TCP","66","38900  >  443 [ACK] Seq=1295 Ack=132257 Win=495 Len=0 TSval=2938439350 TSecr=849752156"
"165","2.657420263","178.135.6.13","192.168.1.68","TLSv1.2","1506","Application Data [TCP segment of a reassembled PDU]"
"166","2.661524765","178.135.6.13","192.168.1.68","TCP","1506","443  >  38900 [PSH, ACK] Seq=133697 Ack=1295 Win=22 Len=1440 TSval=849752160 TSecr=2938439317 [TCP segment of a reassembled PDU]"
"167","2.661760689","178.135.6.13","192.168.1.68","TCP","1506","443  >  38900 [ACK] Seq=135137 Ack=1295 Win=22 Len=1440 TSval=849752164 TSecr=2938439321 [TCP segment of a reassembled PDU]"
"168","2.661872645","192.168.1.68","178.135.6.13","TCP","66","38900  >  443 [ACK] Seq=1295 Ack=136577 Win=495 Len=0 TSval=2938439356 TSecr=849752160"
"169","2.663523064","178.135.6.13","192.168.1.68","TCP","1506","443  >  38900 [PSH, ACK] Seq=136577 Ack=1295 Win=22 Len=1440 TSval=849752164 TSecr=2938439321 [TCP segment of a reassembled PDU]"
"170","2.665104690","178.135.6.13","192.168.1.68","TCP","1506","443  >  38900 [ACK] Seq=138017 Ack=1295 Win=22 Len=1440 TSval=849752168 TSecr=2938439325 [TCP segment of a reassembled PDU]"
"171","2.665203096","192.168.1.68","178.135.6.13","TCP","66","38900  >  443 [ACK] Seq=1295 Ack=139457 Win=495 Len=0 TSval=2938439359 TSecr=849752164"
"172","2.666540417","178.135.6.13","192.168.1.68","TCP","1506","443  >  38900 [PSH, ACK] Seq=139457 Ack=1295 Win=22 Len=1440 TSval=849752168 TSecr=2938439325 [TCP segment of a reassembled PDU]"
"173","2.668595078","178.135.6.13","192.168.1.68","TCP","1506","443  >  38900 [ACK] Seq=140897 Ack=1295 Win=22 Len=1440 TSval=849752171 TSecr=2938439329 [TCP segment of a reassembled PDU]"
"174","2.669833015","192.168.1.68","178.135.6.13","TCP","66","38900  >  443 [ACK] Seq=1295 Ack=142337 Win=495 Len=0 TSval=2938439364 TSecr=849752168"
"175","2.670462005","178.135.6.13","192.168.1.68","TCP","1506","443  >  38900 [PSH, ACK] Seq=142337 Ack=1295 Win=22 Len=1440 TSval=849752171 TSecr=2938439329 [TCP segment of a reassembled PDU]"
"176","2.671985034","178.135.6.13","192.168.1.68","TCP","1506","443  >  38900 [ACK] Seq=143777 Ack=1295 Win=22 Len=1440 TSval=849752175 TSecr=2938439332 [TCP segment of a reassembled PDU]"
"177","2.672067726","192.168.1.68","178.135.6.13","TCP","66","38900  >  443 [ACK] Seq=1295 Ack=145217 Win=495 Len=0 TSval=2938439366 TSecr=849752171"
"178","2.673920476","178.135.6.13","192.168.1.68","TCP","1506","443  >  38900 [PSH, ACK] Seq=145217 Ack=1295 Win=22 Len=1440 TSval=849752175 TSecr=2938439332 [TCP segment of a reassembled PDU]"
"179","2.676245143","178.135.6.13","192.168.1.68","TCP","1506","443  >  38900 [ACK] Seq=146657 Ack=1295 Win=22 Len=1440 TSval=849752179 TSecr=2938439336 [TCP segment of a reassembled PDU]"
"180","2.676304717","192.168.1.68","178.135.6.13","TCP","66","38900  >  443 [ACK] Seq=1295 Ack=148097 Win=495 Len=0 TSval=2938439370 TSecr=849752175"
"181","2.677387188","178.135.6.13","192.168.1.68","TLSv1.2","1506","Application Data [TCP segment of a reassembled PDU]"
"182","2.679501423","178.135.6.13","192.168.1.68","TCP","1506","443  >  38900 [ACK] Seq=149537 Ack=1295 Win=22 Len=1440 TSval=849752183 TSecr=2938439339 [TCP segment of a reassembled PDU]"
"183","2.679619105","192.168.1.68","178.135.6.13","TCP","66","38900  >  443 [ACK] Seq=1295 Ack=150977 Win=495 Len=0 TSval=2938439373 TSecr=849752179"
"184","2.681343836","178.135.6.13","192.168.1.68","TCP","1506","443  >  38900 [PSH, ACK] Seq=150977 Ack=1295 Win=22 Len=1440 TSval=849752183 TSecr=2938439339 [TCP segment of a reassembled PDU]"
"185","2.682862884","178.135.6.13","192.168.1.68","TCP","1506","443  >  38900 [ACK] Seq=152417 Ack=1295 Win=22 Len=1440 TSval=849752187 TSecr=2938439343 [TCP segment of a reassembled PDU]"
"186","2.682924624","192.168.1.68","178.135.6.13","TCP","66","38900  >  443 [ACK] Seq=1295 Ack=153857 Win=495 Len=0 TSval=2938439377 TSecr=849752183"
"187","2.684789316","178.135.6.13","192.168.1.68","TCP","1506","443  >  38900 [PSH, ACK] Seq=153857 Ack=1295 Win=22 Len=1440 TSval=849752187 TSecr=2938439343 [TCP segment of a reassembled PDU]"
"188","2.688228440","178.135.6.13","192.168.1.68","TCP","1506","443  >  38900 [ACK] Seq=155297 Ack=1295 Win=22 Len=1440 TSval=849752188 TSecr=2938439346 [TCP segment of a reassembled PDU]"
"189","2.688296606","192.168.1.68","178.135.6.13","TCP","66","38900  >  443 [ACK] Seq=1295 Ack=156737 Win=495 Len=0 TSval=2938439382 TSecr=849752187"
"190","2.688542377","178.135.6.13","192.168.1.68","TCP","1506","443  >  38900 [PSH, ACK] Seq=156737 Ack=1295 Win=22 Len=1440 TSval=849752188 TSecr=2938439346 [TCP segment of a reassembled PDU]"
"191","2.690218428","178.135.6.13","192.168.1.68","TCP","1506","443  >  38900 [ACK] Seq=158177 Ack=1295 Win=22 Len=1440 TSval=849752194 TSecr=2938439350 [TCP segment of a reassembled PDU]"
"192","2.690313133","192.168.1.68","178.135.6.13","TCP","66","38900  >  443 [ACK] Seq=1295 Ack=159617 Win=495 Len=0 TSval=2938439384 TSecr=849752188"
"193","2.694037489","178.135.6.13","192.168.1.68","TCP","1506","443  >  38900 [ACK] Seq=159617 Ack=1295 Win=22 Len=1440 TSval=849752194 TSecr=2938439350 [TCP segment of a reassembled PDU]"
"194","2.694329356","178.135.6.13","192.168.1.68","TCP","1506","443  >  38900 [PSH, ACK] Seq=161057 Ack=1295 Win=22 Len=1440 TSval=849752194 TSecr=2938439350 [TCP segment of a reassembled PDU]"
"195","2.694405483","192.168.1.68","178.135.6.13","TCP","66","38900  >  443 [ACK] Seq=1295 Ack=162497 Win=495 Len=0 TSval=2938439388 TSecr=849752194"
"196","2.695929280","178.135.6.13","192.168.1.68","TCP","1346","443  >  38900 [ACK] Seq=162497 Ack=1295 Win=22 Len=1280 TSval=849752197 TSecr=2938439356 [TCP segment of a reassembled PDU]"
"197","2.696040537","192.168.1.68","178.135.6.13","TCP","66","38900  >  443 [ACK] Seq=1295 Ack=163777 Win=495 Len=0 TSval=2938439390 TSecr=849752197"
"198","2.697169522","178.135.6.13","192.168.1.68","TLSv1.2","1506","Application Data [TCP segment of a reassembled PDU]"
"199","2.699203858","178.135.6.13","192.168.1.68","TCP","1506","443  >  38900 [PSH, ACK] Seq=165217 Ack=1295 Win=22 Len=1440 TSval=849752197 TSecr=2938439356 [TCP segment of a reassembled PDU]"
"200","2.699345566","192.168.1.68","178.135.6.13","TCP","66","38900  >  443 [ACK] Seq=1295 Ack=166657 Win=495 Len=0 TSval=2938439393 TSecr=849752197"
"201","2.701060170","178.135.6.13","192.168.1.68","TCP","1506","443  >  38900 [ACK] Seq=166657 Ack=1295 Win=22 Len=1440 TSval=849752201 TSecr=2938439359 [TCP segment of a reassembled PDU]"
"202","2.702622939","178.135.6.13","192.168.1.68","TCP","1506","443  >  38900 [PSH, ACK] Seq=168097 Ack=1295 Win=22 Len=1440 TSval=849752201 TSecr=2938439359 [TCP segment of a reassembled PDU]"
"203","2.702700253","192.168.1.68","178.135.6.13","TCP","66","38900  >  443 [ACK] Seq=1295 Ack=169537 Win=495 Len=0 TSval=2938439396 TSecr=849752201"
"204","2.704460742","178.135.6.13","192.168.1.68","TCP","1506","443  >  38900 [ACK] Seq=169537 Ack=1295 Win=22 Len=1440 TSval=849752207 TSecr=2938439364 [TCP segment of a reassembled PDU]"
"205","2.706427752","178.135.6.13","192.168.1.68","TCP","1506","443  >  38900 [PSH, ACK] Seq=170977 Ack=1295 Win=22 Len=1440 TSval=849752207 TSecr=2938439364 [TCP segment of a reassembled PDU]"
"206","2.706492774","192.168.1.68","178.135.6.13","TCP","66","38900  >  443 [ACK] Seq=1295 Ack=172417 Win=495 Len=0 TSval=2938439400 TSecr=849752207"
"207","2.707932133","178.135.6.13","192.168.1.68","TCP","1506","443  >  38900 [ACK] Seq=172417 Ack=1295 Win=22 Len=1440 TSval=849752209 TSecr=2938439366 [TCP segment of a reassembled PDU]"
"208","2.710209378","178.135.6.13","192.168.1.68","TCP","1506","443  >  38900 [PSH, ACK] Seq=173857 Ack=1295 Win=22 Len=1440 TSval=849752209 TSecr=2938439366 [TCP segment of a reassembled PDU]"
"209","2.710305200","192.168.1.68","178.135.6.13","TCP","66","38900  >  443 [ACK] Seq=1295 Ack=175297 Win=495 Len=0 TSval=2938439404 TSecr=849752209"
"210","2.712160883","178.135.6.13","192.168.1.68","TCP","1506","443  >  38900 [ACK] Seq=175297 Ack=1295 Win=22 Len=1440 TSval=849752212 TSecr=2938439370 [TCP segment of a reassembled PDU]"
"211","2.713661842","178.135.6.13","192.168.1.68","TCP","1506","443  >  38900 [ACK] Seq=176737 Ack=1295 Win=22 Len=1440 TSval=849752212 TSecr=2938439370 [TCP segment of a reassembled PDU]"
"212","2.713759131","192.168.1.68","178.135.6.13","TCP","66","38900  >  443 [ACK] Seq=1295 Ack=178177 Win=495 Len=0 TSval=2938439408 TSecr=849752212"
"213","2.713917182","178.135.6.13","192.168.1.68","TCP","226","443  >  38900 [PSH, ACK] Seq=178177 Ack=1295 Win=22 Len=160 TSval=849752212 TSecr=2938439370 [TCP segment of a reassembled PDU]"
"214","2.713982763","192.168.1.68","178.135.6.13","TCP","66","38900  >  443 [ACK] Seq=1295 Ack=178337 Win=495 Len=0 TSval=2938439408 TSecr=849752212"
"215","2.715920719","178.135.6.13","192.168.1.68","TCP","1506","443  >  38900 [ACK] Seq=178337 Ack=1295 Win=22 Len=1440 TSval=849752216 TSecr=2938439373 [TCP segment of a reassembled PDU]"
"216","2.717287862","178.135.6.13","192.168.1.68","TCP","1314","443  >  38900 [PSH, ACK] Seq=179777 Ack=1295 Win=22 Len=1248 TSval=849752216 TSecr=2938439373 [TCP segment of a reassembled PDU]"
"217","2.717374954","192.168.1.68","178.135.6.13","TCP","66","38900  >  443 [ACK] Seq=1295 Ack=181025 Win=495 Len=0 TSval=2938439411 TSecr=849752216"
"218","2.719337913","178.135.6.13","192.168.1.68","TLSv1.2","1506","Application Data [TCP segment of a reassembled PDU]"
"219","2.720886364","178.135.6.13","192.168.1.68","TCP","1506","443  >  38900 [PSH, ACK] Seq=182465 Ack=1295 Win=22 Len=1440 TSval=849752220 TSecr=2938439377 [TCP segment of a reassembled PDU]"
"220","2.720994199","192.168.1.68","178.135.6.13","TCP","66","38900  >  443 [ACK] Seq=1295 Ack=183905 Win=495 Len=0 TSval=2938439415 TSecr=849752220"
"221","2.722763977","178.135.6.13","192.168.1.68","TCP","1506","443  >  38900 [ACK] Seq=183905 Ack=1295 Win=22 Len=1440 TSval=849752226 TSecr=2938439382 [TCP segment of a reassembled PDU]"
"222","2.724839311","178.135.6.13","192.168.1.68","TCP","1506","443  >  38900 [ACK] Seq=185345 Ack=1295 Win=22 Len=1440 TSval=849752226 TSecr=2938439382 [TCP segment of a reassembled PDU]"
"223","2.724922562","178.135.6.13","192.168.1.68","TCP","98","443  >  38900 [PSH, ACK] Seq=186785 Ack=1295 Win=22 Len=32 TSval=849752226 TSecr=2938439382 [TCP segment of a reassembled PDU]"
"224","2.725004067","192.168.1.68","178.135.6.13","TCP","66","38900  >  443 [ACK] Seq=1295 Ack=186817 Win=495 Len=0 TSval=2938439419 TSecr=849752226"
"225","2.726977712","178.135.6.13","192.168.1.68","TCP","1506","443  >  38900 [ACK] Seq=186817 Ack=1295 Win=22 Len=1440 TSval=849752227 TSecr=2938439384 [TCP segment of a reassembled PDU]"
"226","2.728459883","178.135.6.13","192.168.1.68","TCP","1506","443  >  38900 [PSH, ACK] Seq=188257 Ack=1295 Win=22 Len=1440 TSval=849752227 TSecr=2938439384 [TCP segment of a reassembled PDU]"
"227","2.728574144","192.168.1.68","178.135.6.13","TCP","66","38900  >  443 [ACK] Seq=1295 Ack=189697 Win=495 Len=0 TSval=2938439422 TSecr=849752227"
"228","2.730352163","178.135.6.13","192.168.1.68","TCP","1506","443  >  38900 [ACK] Seq=189697 Ack=1295 Win=22 Len=1440 TSval=849752231 TSecr=2938439388 [TCP segment of a reassembled PDU]"
"229","2.732375465","178.135.6.13","192.168.1.68","TCP","1506","443  >  38900 [ACK] Seq=191137 Ack=1295 Win=22 Len=1440 TSval=849752231 TSecr=2938439388 [TCP segment of a reassembled PDU]"
"230","2.732488398","192.168.1.68","178.135.6.13","TCP","66","38900  >  443 [ACK] Seq=1295 Ack=192577 Win=495 Len=0 TSval=2938439426 TSecr=849752231"
"231","2.733792545","178.135.6.13","192.168.1.68","TCP","1282","443  >  38900 [PSH, ACK] Seq=192577 Ack=1295 Win=22 Len=1216 TSval=849752231 TSecr=2938439388 [TCP segment of a reassembled PDU]"
"232","2.733865389","192.168.1.68","178.135.6.13","TCP","66","38900  >  443 [ACK] Seq=1295 Ack=193793 Win=495 Len=0 TSval=2938439428 TSecr=849752231"
"233","2.735105002","178.135.6.13","192.168.1.68","TCP","1506","443  >  38900 [PSH, ACK] Seq=193793 Ack=1295 Win=22 Len=1440 TSval=849752233 TSecr=2938439390 [TCP segment of a reassembled PDU]"
"234","2.737138152","178.135.6.13","192.168.1.68","TCP","1506","443  >  38900 [ACK] Seq=195233 Ack=1295 Win=22 Len=1440 TSval=849752235 TSecr=2938439393 [TCP segment of a reassembled PDU]"
"235","2.737267707","192.168.1.68","178.135.6.13","TCP","66","38900  >  443 [ACK] Seq=1295 Ack=196673 Win=495 Len=0 TSval=2938439431 TSecr=849752233"
"236","2.738986082","178.135.6.13","192.168.1.68","TLSv1.2","1506","Application Data [TCP segment of a reassembled PDU]"
"237","2.740560025","178.135.6.13","192.168.1.68","TCP","1506","443  >  38900 [ACK] Seq=198113 Ack=1295 Win=22 Len=1440 TSval=849752239 TSecr=2938439396 [TCP segment of a reassembled PDU]"
