"No.","Time","Source","Destination","Protocol","Length","Info"
"21","1.940759","192.168.0.111","160.36.131.221","TCP","66","63780  >  80 [SYN] Seq=0 Win=64240 Len=0 MSS=1460 WS=256 SACK_PERM=1"
"22","2.014836","160.36.131.221","192.168.0.111","TCP","66","80  >  63780 [SYN, ACK] Seq=0 Ack=1 Win=14600 Len=0 MSS=1460 SACK_PERM=1 WS=128"
"23","2.014956","192.168.0.111","160.36.131.221","TCP","54","63780  >  80 [ACK] Seq=1 Ack=1 Win=262656 Len=0"
"26","3.106779","192.168.0.111","160.36.131.221","HTTP","473","GET /lapack/lapack-3.7.1.tgz HTTP/1.1 "
"27","3.173978","160.36.131.221","192.168.0.111","TCP","60","80  >  63780 [ACK] Seq=1 Ack=420 Win=15744 Len=0"
"28","3.174993","160.36.131.221","192.168.0.111","TCP","1514","80  >  63780 [ACK] Seq=1 Ack=420 Win=15744 Len=1460 [TCP segment of a reassembled PDU]"
"29","3.175742","160.36.131.221","192.168.0.111","TCP","1514","80  >  63780 [ACK] Seq=1461 Ack=420 Win=15744 Len=1460 [TCP segment of a reassembled PDU]"
"30","3.175742","160.36.131.221","192.168.0.111","TCP","1514","80  >  63780 [ACK] Seq=2921 Ack=420 Win=15744 Len=1460 [TCP segment of a reassembled PDU]"
"31","3.175742","160.36.131.221","192.168.0.111","TCP","1514","80  >  63780 [ACK] Seq=4381 Ack=420 Win=15744 Len=1460 [TCP segment of a reassembled PDU]"
"32","3.175826","192.168.0.111","160.36.131.221","TCP","54","63780  >  80 [ACK] Seq=420 Ack=5841 Win=262656 Len=0"
"33","3.175869","160.36.131.221","192.168.0.111","TCP","1514","80  >  63780 [ACK] Seq=5841 Ack=420 Win=15744 Len=1460 [TCP segment of a reassembled PDU]"
"34","3.175869","160.36.131.221","192.168.0.111","TCP","1514","80  >  63780 [ACK] Seq=7301 Ack=420 Win=15744 Len=1460 [TCP segment of a reassembled PDU]"
"35","3.175869","160.36.131.221","192.168.0.111","TCP","1514","80  >  63780 [ACK] Seq=8761 Ack=420 Win=15744 Len=1460 [TCP segment of a reassembled PDU]"
"36","3.175941","192.168.0.111","160.36.131.221","TCP","54","63780  >  80 [ACK] Seq=420 Ack=10221 Win=262656 Len=0"
"37","3.175984","160.36.131.221","192.168.0.111","TCP","1514","80  >  63780 [ACK] Seq=10221 Ack=420 Win=15744 Len=1460 [TCP segment of a reassembled PDU]"
"38","3.175984","160.36.131.221","192.168.0.111","TCP","1514","80  >  63780 [ACK] Seq=11681 Ack=420 Win=15744 Len=1460 [TCP segment of a reassembled PDU]"
"39","3.175984","160.36.131.221","192.168.0.111","TCP","1514","80  >  63780 [ACK] Seq=13141 Ack=420 Win=15744 Len=1460 [TCP segment of a reassembled PDU]"
"40","3.176031","192.168.0.111","160.36.131.221","TCP","54","63780  >  80 [ACK] Seq=420 Ack=14601 Win=262656 Len=0"
"41","3.235600","160.36.131.221","192.168.0.111","TCP","1514","80  >  63780 [ACK] Seq=14601 Ack=420 Win=15744 Len=1460 [TCP segment of a reassembled PDU]"
"42","3.235834","160.36.131.221","192.168.0.111","TCP","1514","80  >  63780 [PSH, ACK] Seq=16061 Ack=420 Win=15744 Len=1460 [TCP segment of a reassembled PDU]"
"43","3.235834","160.36.131.221","192.168.0.111","TCP","1514","80  >  63780 [ACK] Seq=17521 Ack=420 Win=15744 Len=1460 [TCP segment of a reassembled PDU]"
"44","3.235834","160.36.131.221","192.168.0.111","TCP","1514","80  >  63780 [ACK] Seq=18981 Ack=420 Win=15744 Len=1460 [TCP segment of a reassembled PDU]"
"45","3.235873","192.168.0.111","160.36.131.221","TCP","54","63780  >  80 [ACK] Seq=420 Ack=20441 Win=262656 Len=0"
"46","3.236021","160.36.131.221","192.168.0.111","TCP","1514","80  >  63780 [ACK] Seq=20441 Ack=420 Win=15744 Len=1460 [TCP segment of a reassembled PDU]"
"47","3.236021","160.36.131.221","192.168.0.111","TCP","1514","80  >  63780 [ACK] Seq=21901 Ack=420 Win=15744 Len=1460 [TCP segment of a reassembled PDU]"
"48","3.236021","160.36.131.221","192.168.0.111","TCP","1514","80  >  63780 [ACK] Seq=23361 Ack=420 Win=15744 Len=1460 [TCP segment of a reassembled PDU]"
"49","3.236050","192.168.0.111","160.36.131.221","TCP","54","63780  >  80 [ACK] Seq=420 Ack=24821 Win=262656 Len=0"
"50","3.236088","160.36.131.221","192.168.0.111","TCP","1514","80  >  63780 [ACK] Seq=24821 Ack=420 Win=15744 Len=1460 [TCP segment of a reassembled PDU]"
"51","3.236088","160.36.131.221","192.168.0.111","TCP","1514","80  >  63780 [ACK] Seq=26281 Ack=420 Win=15744 Len=1460 [TCP segment of a reassembled PDU]"
"52","3.236088","160.36.131.221","192.168.0.111","TCP","1514","80  >  63780 [ACK] Seq=27741 Ack=420 Win=15744 Len=1460 [TCP segment of a reassembled PDU]"
"53","3.236132","192.168.0.111","160.36.131.221","TCP","54","63780  >  80 [ACK] Seq=420 Ack=29201 Win=262656 Len=0"
"54","3.236353","160.36.131.221","192.168.0.111","TCP","1514","80  >  63780 [ACK] Seq=29201 Ack=420 Win=15744 Len=1460 [TCP segment of a reassembled PDU]"
"55","3.236353","160.36.131.221","192.168.0.111","TCP","1514","80  >  63780 [ACK] Seq=30661 Ack=420 Win=15744 Len=1460 [TCP segment of a reassembled PDU]"
"56","3.236389","192.168.0.111","160.36.131.221","TCP","54","63780  >  80 [ACK] Seq=420 Ack=32121 Win=262656 Len=0"
"57","3.313873","160.36.131.221","192.168.0.111","TCP","1514","80  >  63780 [ACK] Seq=32121 Ack=420 Win=15744 Len=1460 [TCP segment of a reassembled PDU]"
"58","3.314108","160.36.131.221","192.168.0.111","TCP","1514","80  >  63780 [ACK] Seq=33581 Ack=420 Win=15744 Len=1460 [TCP segment of a reassembled PDU]"
"59","3.314108","160.36.131.221","192.168.0.111","TCP","1514","80  >  63780 [ACK] Seq=35041 Ack=420 Win=15744 Len=1460 [TCP segment of a reassembled PDU]"
"60","3.314108","160.36.131.221","192.168.0.111","TCP","1514","80  >  63780 [ACK] Seq=36501 Ack=420 Win=15744 Len=1460 [TCP segment of a reassembled PDU]"
"61","3.314137","192.168.0.111","160.36.131.221","TCP","54","63780  >  80 [ACK] Seq=420 Ack=37961 Win=262656 Len=0"
"62","3.314259","160.36.131.221","192.168.0.111","TCP","1514","80  >  63780 [ACK] Seq=37961 Ack=420 Win=15744 Len=1460 [TCP segment of a reassembled PDU]"
"63","3.314470","160.36.131.221","192.168.0.111","TCP","1514","80  >  63780 [ACK] Seq=39421 Ack=420 Win=15744 Len=1460 [TCP segment of a reassembled PDU]"
"64","3.314470","160.36.131.221","192.168.0.111","TCP","1514","80  >  63780 [ACK] Seq=40881 Ack=420 Win=15744 Len=1460 [TCP segment of a reassembled PDU]"
"65","3.314470","160.36.131.221","192.168.0.111","TCP","1514","80  >  63780 [ACK] Seq=42341 Ack=420 Win=15744 Len=1460 [TCP segment of a reassembled PDU]"
"66","3.314524","192.168.0.111","160.36.131.221","TCP","54","63780  >  80 [ACK] Seq=420 Ack=43801 Win=262656 Len=0"
"67","3.314564","160.36.131.221","192.168.0.111","TCP","1514","80  >  63780 [ACK] Seq=43801 Ack=420 Win=15744 Len=1460 [TCP segment of a reassembled PDU]"
"68","3.314564","160.36.131.221","192.168.0.111","TCP","1514","80  >  63780 [ACK] Seq=45261 Ack=420 Win=15744 Len=1460 [TCP segment of a reassembled PDU]"
"69","3.314605","192.168.0.111","160.36.131.221","TCP","54","63780  >  80 [ACK] Seq=420 Ack=46721 Win=262656 Len=0"
"70","3.314834","160.36.131.221","192.168.0.111","TCP","1514","80  >  63780 [ACK] Seq=46721 Ack=420 Win=15744 Len=1460 [TCP segment of a reassembled PDU]"
"71","3.314834","160.36.131.221","192.168.0.111","TCP","1514","80  >  63780 [ACK] Seq=48181 Ack=420 Win=15744 Len=1460 [TCP segment of a reassembled PDU]"
"72","3.314834","160.36.131.221","192.168.0.111","TCP","1514","80  >  63780 [ACK] Seq=49641 Ack=420 Win=15744 Len=1460 [TCP segment of a reassembled PDU]"
"73","3.314945","160.36.131.221","192.168.0.111","TCP","1514","80  >  63780 [PSH, ACK] Seq=51101 Ack=420 Win=15744 Len=1460 [TCP segment of a reassembled PDU]"
"74","3.315006","192.168.0.111","160.36.131.221","TCP","54","63780  >  80 [ACK] Seq=420 Ack=52561 Win=262656 Len=0"
"77","3.378656","160.36.131.221","192.168.0.111","TCP","1514","80  >  63780 [ACK] Seq=52561 Ack=420 Win=15744 Len=1460 [TCP segment of a reassembled PDU]"
"78","3.378894","160.36.131.221","192.168.0.111","TCP","1514","80  >  63780 [ACK] Seq=54021 Ack=420 Win=15744 Len=1460 [TCP segment of a reassembled PDU]"
"79","3.378894","160.36.131.221","192.168.0.111","TCP","1514","80  >  63780 [ACK] Seq=55481 Ack=420 Win=15744 Len=1460 [TCP segment of a reassembled PDU]"
"80","3.378999","192.168.0.111","160.36.131.221","TCP","54","63780  >  80 [ACK] Seq=420 Ack=56941 Win=262656 Len=0"
"81","3.379230","160.36.131.221","192.168.0.111","TCP","1514","80  >  63780 [ACK] Seq=56941 Ack=420 Win=15744 Len=1460 [TCP segment of a reassembled PDU]"
"82","3.379230","160.36.131.221","192.168.0.111","TCP","1514","80  >  63780 [ACK] Seq=58401 Ack=420 Win=15744 Len=1460 [TCP segment of a reassembled PDU]"
"83","3.379230","160.36.131.221","192.168.0.111","TCP","1514","80  >  63780 [ACK] Seq=59861 Ack=420 Win=15744 Len=1460 [TCP segment of a reassembled PDU]"
"84","3.379307","160.36.131.221","192.168.0.111","TCP","1514","80  >  63780 [ACK] Seq=61321 Ack=420 Win=15744 Len=1460 [TCP segment of a reassembled PDU]"
"85","3.379501","192.168.0.111","160.36.131.221","TCP","54","63780  >  80 [ACK] Seq=420 Ack=62781 Win=262656 Len=0"
"86","3.379581","160.36.131.221","192.168.0.111","TCP","1514","80  >  63780 [ACK] Seq=62781 Ack=420 Win=15744 Len=1460 [TCP segment of a reassembled PDU]"
"87","3.379581","160.36.131.221","192.168.0.111","TCP","1514","80  >  63780 [ACK] Seq=64241 Ack=420 Win=15744 Len=1460 [TCP segment of a reassembled PDU]"
"88","3.379581","160.36.131.221","192.168.0.111","TCP","1514","80  >  63780 [ACK] Seq=65701 Ack=420 Win=15744 Len=1460 [TCP segment of a reassembled PDU]"
"89","3.379638","160.36.131.221","192.168.0.111","TCP","1514","80  >  63780 [ACK] Seq=67161 Ack=420 Win=15744 Len=1460 [TCP segment of a reassembled PDU]"
"90","3.379638","160.36.131.221","192.168.0.111","TCP","1514","80  >  63780 [ACK] Seq=68621 Ack=420 Win=15744 Len=1460 [TCP segment of a reassembled PDU]"
"91","3.379638","160.36.131.221","192.168.0.111","TCP","1514","80  >  63780 [ACK] Seq=70081 Ack=420 Win=15744 Len=1460 [TCP segment of a reassembled PDU]"
"92","3.379727","160.36.131.221","192.168.0.111","TCP","1514","80  >  63780 [ACK] Seq=71541 Ack=420 Win=15744 Len=1460 [TCP segment of a reassembled PDU]"
"93","3.379727","160.36.131.221","192.168.0.111","TCP","1514","80  >  63780 [ACK] Seq=73001 Ack=420 Win=15744 Len=1460 [TCP segment of a reassembled PDU]"
"94","3.379822","192.168.0.111","160.36.131.221","TCP","54","63780  >  80 [ACK] Seq=420 Ack=74461 Win=262656 Len=0"
"95","3.380041","160.36.131.221","192.168.0.111","TCP","1514","80  >  63780 [PSH, ACK] Seq=74461 Ack=420 Win=15744 Len=1460 [TCP segment of a reassembled PDU]"
"96","3.380234","192.168.0.111","160.36.131.221","TCP","54","63780  >  80 [ACK] Seq=420 Ack=75921 Win=262656 Len=0"
"97","3.438975","160.36.131.221","192.168.0.111","TCP","1514","80  >  63780 [ACK] Seq=75921 Ack=420 Win=15744 Len=1460 [TCP segment of a reassembled PDU]"
"98","3.439167","160.36.131.221","192.168.0.111","TCP","1514","80  >  63780 [ACK] Seq=77381 Ack=420 Win=15744 Len=1460 [TCP segment of a reassembled PDU]"
"99","3.439167","160.36.131.221","192.168.0.111","TCP","1514","80  >  63780 [ACK] Seq=78841 Ack=420 Win=15744 Len=1460 [TCP segment of a reassembled PDU]"
"100","3.439167","160.36.131.221","192.168.0.111","TCP","1514","80  >  63780 [ACK] Seq=80301 Ack=420 Win=15744 Len=1460 [TCP segment of a reassembled PDU]"
"101","3.439228","160.36.131.221","192.168.0.111","TCP","1514","80  >  63780 [ACK] Seq=81761 Ack=420 Win=15744 Len=1460 [TCP segment of a reassembled PDU]"
"102","3.439228","160.36.131.221","192.168.0.111","TCP","1514","80  >  63780 [ACK] Seq=83221 Ack=420 Win=15744 Len=1460 [TCP segment of a reassembled PDU]"
"103","3.439228","160.36.131.221","192.168.0.111","TCP","1514","80  >  63780 [ACK] Seq=84681 Ack=420 Win=15744 Len=1460 [TCP segment of a reassembled PDU]"
"104","3.439311","192.168.0.111","160.36.131.221","TCP","54","63780  >  80 [ACK] Seq=420 Ack=86141 Win=262656 Len=0"
"105","3.439462","160.36.131.221","192.168.0.111","TCP","1514","80  >  63780 [ACK] Seq=86141 Ack=420 Win=15744 Len=1460 [TCP segment of a reassembled PDU]"
"106","3.439462","160.36.131.221","192.168.0.111","TCP","1514","80  >  63780 [ACK] Seq=87601 Ack=420 Win=15744 Len=1460 [TCP segment of a reassembled PDU]"
"107","3.439462","160.36.131.221","192.168.0.111","TCP","1514","80  >  63780 [ACK] Seq=89061 Ack=420 Win=15744 Len=1460 [TCP segment of a reassembled PDU]"
"108","3.439477","160.36.131.221","192.168.0.111","TCP","1514","80  >  63780 [ACK] Seq=90521 Ack=420 Win=15744 Len=1460 [TCP segment of a reassembled PDU]"
"109","3.439609","192.168.0.111","160.36.131.221","TCP","54","63780  >  80 [ACK] Seq=420 Ack=91981 Win=262656 Len=0"
"110","3.439812","160.36.131.221","192.168.0.111","TCP","1514","80  >  63780 [ACK] Seq=91981 Ack=420 Win=15744 Len=1460 [TCP segment of a reassembled PDU]"
"111","3.439812","160.36.131.221","192.168.0.111","TCP","1514","80  >  63780 [ACK] Seq=93441 Ack=420 Win=15744 Len=1460 [TCP segment of a reassembled PDU]"
"112","3.439812","160.36.131.221","192.168.0.111","TCP","1514","80  >  63780 [ACK] Seq=94901 Ack=420 Win=15744 Len=1460 [TCP segment of a reassembled PDU]"
"113","3.439832","192.168.0.111","160.36.131.221","TCP","54","63780  >  80 [ACK] Seq=420 Ack=96361 Win=262656 Len=0"
"114","3.440135","160.36.131.221","192.168.0.111","TCP","1514","80  >  63780 [ACK] Seq=96361 Ack=420 Win=15744 Len=1460 [TCP segment of a reassembled PDU]"
"115","3.440135","160.36.131.221","192.168.0.111","TCP","1514","80  >  63780 [ACK] Seq=97821 Ack=420 Win=15744 Len=1460 [TCP segment of a reassembled PDU]"
"116","3.440155","192.168.0.111","160.36.131.221","TCP","54","63780  >  80 [ACK] Seq=420 Ack=99281 Win=262656 Len=0"
"117","3.448220","160.36.131.221","192.168.0.111","TCP","1514","80  >  63780 [ACK] Seq=99281 Ack=420 Win=15744 Len=1460 [TCP segment of a reassembled PDU]"
"118","3.448466","160.36.131.221","192.168.0.111","TCP","1514","80  >  63780 [ACK] Seq=100741 Ack=420 Win=15744 Len=1460 [TCP segment of a reassembled PDU]"
"119","3.448530","192.168.0.111","160.36.131.221","TCP","54","63780  >  80 [ACK] Seq=420 Ack=102201 Win=262656 Len=0"
"120","3.498956","160.36.131.221","192.168.0.111","TCP","1514","80  >  63780 [ACK] Seq=102201 Ack=420 Win=15744 Len=1460 [TCP segment of a reassembled PDU]"
"121","3.498974","160.36.131.221","192.168.0.111","TCP","1514","80  >  63780 [PSH, ACK] Seq=103661 Ack=420 Win=15744 Len=1460 [TCP segment of a reassembled PDU]"
"122","3.498974","160.36.131.221","192.168.0.111","TCP","1514","80  >  63780 [ACK] Seq=105121 Ack=420 Win=15744 Len=1460 [TCP segment of a reassembled PDU]"
"123","3.498974","160.36.131.221","192.168.0.111","TCP","1514","80  >  63780 [ACK] Seq=106581 Ack=420 Win=15744 Len=1460 [TCP segment of a reassembled PDU]"
"124","3.498985","160.36.131.221","192.168.0.111","TCP","1514","80  >  63780 [ACK] Seq=108041 Ack=420 Win=15744 Len=1460 [TCP segment of a reassembled PDU]"
"125","3.498985","160.36.131.221","192.168.0.111","TCP","1514","80  >  63780 [ACK] Seq=109501 Ack=420 Win=15744 Len=1460 [TCP segment of a reassembled PDU]"
"126","3.498985","160.36.131.221","192.168.0.111","TCP","1514","80  >  63780 [ACK] Seq=110961 Ack=420 Win=15744 Len=1460 [TCP segment of a reassembled PDU]"
"127","3.499045","192.168.0.111","160.36.131.221","TCP","54","63780  >  80 [ACK] Seq=420 Ack=112421 Win=262656 Len=0"
"128","3.499193","160.36.131.221","192.168.0.111","TCP","1514","80  >  63780 [ACK] Seq=112421 Ack=420 Win=15744 Len=1460 [TCP segment of a reassembled PDU]"
"129","3.499193","160.36.131.221","192.168.0.111","TCP","1514","80  >  63780 [ACK] Seq=113881 Ack=420 Win=15744 Len=1460 [TCP segment of a reassembled PDU]"
"130","3.499193","160.36.131.221","192.168.0.111","TCP","1514","80  >  63780 [ACK] Seq=115341 Ack=420 Win=15744 Len=1460 [TCP segment of a reassembled PDU]"
"131","3.499223","160.36.131.221","192.168.0.111","TCP","1514","80  >  63780 [ACK] Seq=116801 Ack=420 Win=15744 Len=1460 [TCP segment of a reassembled PDU]"
"132","3.499266","192.168.0.111","160.36.131.221","TCP","54","63780  >  80 [ACK] Seq=420 Ack=118261 Win=262656 Len=0"
"133","3.499492","160.36.131.221","192.168.0.111","TCP","1514","80  >  63780 [ACK] Seq=118261 Ack=420 Win=15744 Len=1460 [TCP segment of a reassembled PDU]"
"134","3.499492","160.36.131.221","192.168.0.111","TCP","1514","80  >  63780 [ACK] Seq=119721 Ack=420 Win=15744 Len=1460 [TCP segment of a reassembled PDU]"
"135","3.499492","160.36.131.221","192.168.0.111","TCP","1514","80  >  63780 [ACK] Seq=121181 Ack=420 Win=15744 Len=1460 [TCP segment of a reassembled PDU]"
"136","3.499574","192.168.0.111","160.36.131.221","TCP","54","63780  >  80 [ACK] Seq=420 Ack=122641 Win=262656 Len=0"
"137","3.499631","160.36.131.221","192.168.0.111","TCP","1514","80  >  63780 [ACK] Seq=122641 Ack=420 Win=15744 Len=1460 [TCP segment of a reassembled PDU]"
"138","3.499631","160.36.131.221","192.168.0.111","TCP","1514","80  >  63780 [ACK] Seq=124101 Ack=420 Win=15744 Len=1460 [TCP segment of a reassembled PDU]"
"139","3.499631","160.36.131.221","192.168.0.111","TCP","1514","80  >  63780 [ACK] Seq=125561 Ack=420 Win=15744 Len=1460 [TCP segment of a reassembled PDU]"
"140","3.499711","192.168.0.111","160.36.131.221","TCP","54","63780  >  80 [ACK] Seq=420 Ack=127021 Win=262656 Len=0"
"141","3.499774","160.36.131.221","192.168.0.111","TCP","1514","80  >  63780 [ACK] Seq=127021 Ack=420 Win=15744 Len=1460 [TCP segment of a reassembled PDU]"
"142","3.499847","192.168.0.111","160.36.131.221","TCP","54","63780  >  80 [ACK] Seq=420 Ack=128481 Win=262656 Len=0"
"143","3.506683","160.36.131.221","192.168.0.111","TCP","1514","80  >  63780 [ACK] Seq=128481 Ack=420 Win=15744 Len=1460 [TCP segment of a reassembled PDU]"
"144","3.506859","160.36.131.221","192.168.0.111","TCP","1514","80  >  63780 [ACK] Seq=129941 Ack=420 Win=15744 Len=1460 [TCP segment of a reassembled PDU]"
"145","3.506859","160.36.131.221","192.168.0.111","TCP","1514","80  >  63780 [ACK] Seq=131401 Ack=420 Win=15744 Len=1460 [TCP segment of a reassembled PDU]"
"146","3.506859","160.36.131.221","192.168.0.111","TCP","1514","80  >  63780 [PSH, ACK] Seq=132861 Ack=420 Win=15744 Len=1460 [TCP segment of a reassembled PDU]"
"147","3.506890","192.168.0.111","160.36.131.221","TCP","54","63780  >  80 [ACK] Seq=420 Ack=134321 Win=262656 Len=0"
"148","3.575138","160.36.131.221","192.168.0.111","TCP","1514","80  >  63780 [ACK] Seq=134321 Ack=420 Win=15744 Len=1460 [TCP segment of a reassembled PDU]"
"149","3.575167","160.36.131.221","192.168.0.111","TCP","1514","80  >  63780 [ACK] Seq=135781 Ack=420 Win=15744 Len=1460 [TCP segment of a reassembled PDU]"
"150","3.575167","160.36.131.221","192.168.0.111","TCP","1514","80  >  63780 [ACK] Seq=137241 Ack=420 Win=15744 Len=1460 [TCP segment of a reassembled PDU]"
"151","3.575167","160.36.131.221","192.168.0.111","TCP","1514","80  >  63780 [ACK] Seq=138701 Ack=420 Win=15744 Len=1460 [TCP segment of a reassembled PDU]"
"152","3.575238","192.168.0.111","160.36.131.221","TCP","54","63780  >  80 [ACK] Seq=420 Ack=140161 Win=262656 Len=0"
"153","3.575287","160.36.131.221","192.168.0.111","TCP","1514","80  >  63780 [ACK] Seq=140161 Ack=420 Win=15744 Len=1460 [TCP segment of a reassembled PDU]"
"154","3.575287","160.36.131.221","192.168.0.111","TCP","1514","80  >  63780 [ACK] Seq=141621 Ack=420 Win=15744 Len=1460 [TCP segment of a reassembled PDU]"
"155","3.575287","160.36.131.221","192.168.0.111","TCP","1514","80  >  63780 [ACK] Seq=143081 Ack=420 Win=15744 Len=1460 [TCP segment of a reassembled PDU]"
"156","3.575336","192.168.0.111","160.36.131.221","TCP","54","63780  >  80 [ACK] Seq=420 Ack=144541 Win=262656 Len=0"
"157","3.575365","160.36.131.221","192.168.0.111","TCP","1514","80  >  63780 [ACK] Seq=144541 Ack=420 Win=15744 Len=1460 [TCP segment of a reassembled PDU]"
"158","3.575365","160.36.131.221","192.168.0.111","TCP","1514","80  >  63780 [ACK] Seq=146001 Ack=420 Win=15744 Len=1460 [TCP segment of a reassembled PDU]"
"159","3.575365","160.36.131.221","192.168.0.111","TCP","1514","80  >  63780 [ACK] Seq=147461 Ack=420 Win=15744 Len=1460 [TCP segment of a reassembled PDU]"
"160","3.575365","160.36.131.221","192.168.0.111","TCP","1514","80  >  63780 [ACK] Seq=148921 Ack=420 Win=15744 Len=1460 [TCP segment of a reassembled PDU]"
"161","3.575406","192.168.0.111","160.36.131.221","TCP","54","63780  >  80 [ACK] Seq=420 Ack=150381 Win=262656 Len=0"
"162","3.575724","160.36.131.221","192.168.0.111","TCP","1514","80  >  63780 [ACK] Seq=150381 Ack=420 Win=15744 Len=1460 [TCP segment of a reassembled PDU]"
"163","3.575724","160.36.131.221","192.168.0.111","TCP","1514","80  >  63780 [ACK] Seq=151841 Ack=420 Win=15744 Len=1460 [TCP segment of a reassembled PDU]"
"164","3.575724","160.36.131.221","192.168.0.111","TCP","1514","80  >  63780 [ACK] Seq=153301 Ack=420 Win=15744 Len=1460 [TCP segment of a reassembled PDU]"
"165","3.575724","160.36.131.221","192.168.0.111","TCP","1514","80  >  63780 [ACK] Seq=154761 Ack=420 Win=15744 Len=1460 [TCP segment of a reassembled PDU]"
"166","3.575724","160.36.131.221","192.168.0.111","TCP","1514","80  >  63780 [ACK] Seq=156221 Ack=420 Win=15744 Len=1460 [TCP segment of a reassembled PDU]"
"167","3.575724","160.36.131.221","192.168.0.111","TCP","1514","80  >  63780 [ACK] Seq=157681 Ack=420 Win=15744 Len=1460 [TCP segment of a reassembled PDU]"
"168","3.575724","160.36.131.221","192.168.0.111","TCP","1514","80  >  63780 [ACK] Seq=159141 Ack=420 Win=15744 Len=1460 [TCP segment of a reassembled PDU]"
"169","3.575724","160.36.131.221","192.168.0.111","TCP","1514","80  >  63780 [ACK] Seq=160601 Ack=420 Win=15744 Len=1460 [TCP segment of a reassembled PDU]"
"170","3.575882","192.168.0.111","160.36.131.221","TCP","54","63780  >  80 [ACK] Seq=420 Ack=162061 Win=262656 Len=0"
"171","3.576051","160.36.131.221","192.168.0.111","TCP","1514","80  >  63780 [PSH, ACK] Seq=162061 Ack=420 Win=15744 Len=1460 [TCP segment of a reassembled PDU]"
"172","3.576106","192.168.0.111","160.36.131.221","TCP","54","63780  >  80 [ACK] Seq=420 Ack=163521 Win=262656 Len=0"
"173","3.582263","160.36.131.221","192.168.0.111","TCP","1514","80  >  63780 [ACK] Seq=163521 Ack=420 Win=15744 Len=1460 [TCP segment of a reassembled PDU]"
"174","3.582522","160.36.131.221","192.168.0.111","TCP","1514","80  >  63780 [ACK] Seq=164981 Ack=420 Win=15744 Len=1460 [TCP segment of a reassembled PDU]"
"175","3.582522","160.36.131.221","192.168.0.111","TCP","1514","80  >  63780 [ACK] Seq=166441 Ack=420 Win=15744 Len=1460 [TCP segment of a reassembled PDU]"
"176","3.582522","160.36.131.221","192.168.0.111","TCP","1514","80  >  63780 [ACK] Seq=167901 Ack=420 Win=15744 Len=1460 [TCP segment of a reassembled PDU]"
"177","3.582577","192.168.0.111","160.36.131.221","TCP","54","63780  >  80 [ACK] Seq=420 Ack=169361 Win=262656 Len=0"
"179","3.633459","160.36.131.221","192.168.0.111","TCP","1514","80  >  63780 [ACK] Seq=169361 Ack=420 Win=15744 Len=1460 [TCP segment of a reassembled PDU]"
"180","3.633773","160.36.131.221","192.168.0.111","TCP","1514","80  >  63780 [ACK] Seq=170821 Ack=420 Win=15744 Len=1460 [TCP segment of a reassembled PDU]"
"181","3.633773","160.36.131.221","192.168.0.111","TCP","1514","80  >  63780 [ACK] Seq=172281 Ack=420 Win=15744 Len=1460 [TCP segment of a reassembled PDU]"
"182","3.633773","160.36.131.221","192.168.0.111","TCP","1514","80  >  63780 [ACK] Seq=173741 Ack=420 Win=15744 Len=1460 [TCP segment of a reassembled PDU]"
"183","3.633773","160.36.131.221","192.168.0.111","TCP","1514","80  >  63780 [ACK] Seq=175201 Ack=420 Win=15744 Len=1460 [TCP segment of a reassembled PDU]"
"184","3.633931","192.168.0.111","160.36.131.221","TCP","54","63780  >  80 [ACK] Seq=420 Ack=176661 Win=262656 Len=0"
"185","3.634062","160.36.131.221","192.168.0.111","TCP","1514","80  >  63780 [ACK] Seq=176661 Ack=420 Win=15744 Len=1460 [TCP segment of a reassembled PDU]"
"186","3.634062","160.36.131.221","192.168.0.111","TCP","1514","80  >  63780 [ACK] Seq=178121 Ack=420 Win=15744 Len=1460 [TCP segment of a reassembled PDU]"
"187","3.634062","160.36.131.221","192.168.0.111","TCP","1514","80  >  63780 [ACK] Seq=179581 Ack=420 Win=15744 Len=1460 [TCP segment of a reassembled PDU]"
"188","3.634062","160.36.131.221","192.168.0.111","TCP","1514","80  >  63780 [ACK] Seq=181041 Ack=420 Win=15744 Len=1460 [TCP segment of a reassembled PDU]"
"189","3.634062","160.36.131.221","192.168.0.111","TCP","1514","80  >  63780 [ACK] Seq=182501 Ack=420 Win=15744 Len=1460 [TCP segment of a reassembled PDU]"
"190","3.634155","160.36.131.221","192.168.0.111","TCP","1514","80  >  63780 [ACK] Seq=183961 Ack=420 Win=15744 Len=1460 [TCP segment of a reassembled PDU]"
"191","3.634155","160.36.131.221","192.168.0.111","TCP","1514","80  >  63780 [ACK] Seq=185421 Ack=420 Win=15744 Len=1460 [TCP segment of a reassembled PDU]"
"192","3.634155","160.36.131.221","192.168.0.111","TCP","1514","80  >  63780 [ACK] Seq=186881 Ack=420 Win=15744 Len=1460 [TCP segment of a reassembled PDU]"
"193","3.634257","192.168.0.111","160.36.131.221","TCP","54","63780  >  80 [ACK] Seq=420 Ack=188341 Win=262656 Len=0"
"194","3.634465","160.36.131.221","192.168.0.111","TCP","1514","80  >  63780 [ACK] Seq=188341 Ack=420 Win=15744 Len=1460 [TCP segment of a reassembled PDU]"
"195","3.634465","160.36.131.221","192.168.0.111","TCP","1514","80  >  63780 [ACK] Seq=189801 Ack=420 Win=15744 Len=1460 [TCP segment of a reassembled PDU]"
"196","3.634544","192.168.0.111","160.36.131.221","TCP","54","63780  >  80 [ACK] Seq=420 Ack=191261 Win=262656 Len=0"
"197","3.634610","160.36.131.221","192.168.0.111","TCP","1514","80  >  63780 [PSH, ACK] Seq=191261 Ack=420 Win=15744 Len=1460 [TCP segment of a reassembled PDU]"
"198","3.634610","160.36.131.221","192.168.0.111","TCP","1514","80  >  63780 [ACK] Seq=192721 Ack=420 Win=15744 Len=1460 [TCP segment of a reassembled PDU]"
"199","3.634610","160.36.131.221","192.168.0.111","TCP","1514","80  >  63780 [ACK] Seq=194181 Ack=420 Win=15744 Len=1460 [TCP segment of a reassembled PDU]"
"200","3.634688","192.168.0.111","160.36.131.221","TCP","54","63780  >  80 [ACK] Seq=420 Ack=195641 Win=262656 Len=0"
"201","3.634742","160.36.131.221","192.168.0.111","TCP","1514","80  >  63780 [ACK] Seq=195641 Ack=420 Win=15744 Len=1460 [TCP segment of a reassembled PDU]"
"202","3.634742","160.36.131.221","192.168.0.111","TCP","1514","80  >  63780 [ACK] Seq=197101 Ack=420 Win=15744 Len=1460 [TCP segment of a reassembled PDU]"
"203","3.634815","192.168.0.111","160.36.131.221","TCP","54","63780  >  80 [ACK] Seq=420 Ack=198561 Win=262656 Len=0"
"204","3.634874","160.36.131.221","192.168.0.111","TCP","1514","80  >  63780 [ACK] Seq=198561 Ack=420 Win=15744 Len=1460 [TCP segment of a reassembled PDU]"
"205","3.635105","160.36.131.221","192.168.0.111","TCP","1514","80  >  63780 [ACK] Seq=200021 Ack=420 Win=15744 Len=1460 [TCP segment of a reassembled PDU]"
"206","3.635105","160.36.131.221","192.168.0.111","TCP","1514","80  >  63780 [ACK] Seq=201481 Ack=420 Win=15744 Len=1460 [TCP segment of a reassembled PDU]"
"207","3.635217","192.168.0.111","160.36.131.221","TCP","54","63780  >  80 [ACK] Seq=420 Ack=202941 Win=262656 Len=0"
"208","3.642057","160.36.131.221","192.168.0.111","TCP","1514","80  >  63780 [ACK] Seq=202941 Ack=420 Win=15744 Len=1460 [TCP segment of a reassembled PDU]"
"209","3.642122","160.36.131.221","192.168.0.111","TCP","1514","80  >  63780 [ACK] Seq=204401 Ack=420 Win=15744 Len=1460 [TCP segment of a reassembled PDU]"
"210","3.642250","192.168.0.111","160.36.131.221","TCP","54","63780  >  80 [ACK] Seq=420 Ack=205861 Win=262656 Len=0"
"211","3.642371","160.36.131.221","192.168.0.111","TCP","1514","80  >  63780 [ACK] Seq=205861 Ack=420 Win=15744 Len=1460 [TCP segment of a reassembled PDU]"
"212","3.642371","160.36.131.221","192.168.0.111","TCP","1514","80  >  63780 [ACK] Seq=207321 Ack=420 Win=15744 Len=1460 [TCP segment of a reassembled PDU]"
"213","3.642471","192.168.0.111","160.36.131.221","TCP","54","63780  >  80 [ACK] Seq=420 Ack=208781 Win=262656 Len=0"
"214","3.695533","160.36.131.221","192.168.0.111","TCP","1514","80  >  63780 [ACK] Seq=208781 Ack=420 Win=15744 Len=1460 [TCP segment of a reassembled PDU]"
"215","3.695592","160.36.131.221","192.168.0.111","TCP","1514","80  >  63780 [ACK] Seq=210241 Ack=420 Win=15744 Len=1460 [TCP segment of a reassembled PDU]"
"216","3.695592","160.36.131.221","192.168.0.111","TCP","1514","80  >  63780 [ACK] Seq=211701 Ack=420 Win=15744 Len=1460 [TCP segment of a reassembled PDU]"
"217","3.695733","192.168.0.111","160.36.131.221","TCP","54","63780  >  80 [ACK] Seq=420 Ack=213161 Win=262656 Len=0"
"218","3.695852","160.36.131.221","192.168.0.111","TCP","1514","80  >  63780 [ACK] Seq=213161 Ack=420 Win=15744 Len=1460 [TCP segment of a reassembled PDU]"
"219","3.695852","160.36.131.221","192.168.0.111","TCP","1514","80  >  63780 [ACK] Seq=214621 Ack=420 Win=15744 Len=1460 [TCP segment of a reassembled PDU]"
"220","3.695852","160.36.131.221","192.168.0.111","TCP","1514","80  >  63780 [ACK] Seq=216081 Ack=420 Win=15744 Len=1460 [TCP segment of a reassembled PDU]"
"221","3.695852","160.36.131.221","192.168.0.111","TCP","1514","80  >  63780 [ACK] Seq=217541 Ack=420 Win=15744 Len=1460 [TCP segment of a reassembled PDU]"
"222","3.695852","160.36.131.221","192.168.0.111","TCP","1514","80  >  63780 [ACK] Seq=219001 Ack=420 Win=15744 Len=1460 [TCP segment of a reassembled PDU]"
"223","3.695852","160.36.131.221","192.168.0.111","TCP","1514","80  >  63780 [ACK] Seq=220461 Ack=420 Win=15744 Len=1460 [TCP segment of a reassembled PDU]"
"224","3.695852","160.36.131.221","192.168.0.111","TCP","1514","80  >  63780 [ACK] Seq=221921 Ack=420 Win=15744 Len=1460 [TCP segment of a reassembled PDU]"
"225","3.695852","160.36.131.221","192.168.0.111","TCP","1514","80  >  63780 [ACK] Seq=223381 Ack=420 Win=15744 Len=1460 [TCP segment of a reassembled PDU]"
"226","3.695930","160.36.131.221","192.168.0.111","TCP","1514","80  >  63780 [ACK] Seq=224841 Ack=420 Win=15744 Len=1460 [TCP segment of a reassembled PDU]"
"227","3.695930","160.36.131.221","192.168.0.111","TCP","1514","80  >  63780 [ACK] Seq=226301 Ack=420 Win=15744 Len=1460 [TCP segment of a reassembled PDU]"
"228","3.696046","192.168.0.111","160.36.131.221","TCP","54","63780  >  80 [ACK] Seq=420 Ack=227761 Win=262656 Len=0"
"229","3.696174","160.36.131.221","192.168.0.111","TCP","1514","80  >  63780 [ACK] Seq=227761 Ack=420 Win=15744 Len=1460 [TCP segment of a reassembled PDU]"
"230","3.696174","160.36.131.221","192.168.0.111","TCP","1514","80  >  63780 [ACK] Seq=229221 Ack=420 Win=15744 Len=1460 [TCP segment of a reassembled PDU]"
"231","3.696174","160.36.131.221","192.168.0.111","TCP","1514","80  >  63780 [ACK] Seq=230681 Ack=420 Win=15744 Len=1460 [TCP segment of a reassembled PDU]"
"232","3.696174","160.36.131.221","192.168.0.111","TCP","1514","80  >  63780 [ACK] Seq=232141 Ack=420 Win=15744 Len=1460 [TCP segment of a reassembled PDU]"
"233","3.696264","192.168.0.111","160.36.131.221","TCP","54","63780  >  80 [ACK] Seq=420 Ack=233601 Win=262656 Len=0"
"234","3.696347","160.36.131.221","192.168.0.111","TCP","1514","80  >  63780 [ACK] Seq=233601 Ack=420 Win=15744 Len=1460 [TCP segment of a reassembled PDU]"
"235","3.696347","160.36.131.221","192.168.0.111","TCP","1514","80  >  63780 [ACK] Seq=235061 Ack=420 Win=15744 Len=1460 [TCP segment of a reassembled PDU]"
"236","3.696347","160.36.131.221","192.168.0.111","TCP","1514","80  >  63780 [ACK] Seq=236521 Ack=420 Win=15744 Len=1460 [TCP segment of a reassembled PDU]"
"237","3.696347","160.36.131.221","192.168.0.111","TCP","1514","80  >  63780 [ACK] Seq=237981 Ack=420 Win=15744 Len=1460 [TCP segment of a reassembled PDU]"
"238","3.696454","192.168.0.111","160.36.131.221","TCP","54","63780  >  80 [ACK] Seq=420 Ack=239441 Win=262656 Len=0"
"239","3.696544","160.36.131.221","192.168.0.111","TCP","1514","80  >  63780 [ACK] Seq=239441 Ack=420 Win=15744 Len=1460 [TCP segment of a reassembled PDU]"
"240","3.696544","160.36.131.221","192.168.0.111","TCP","1514","80  >  63780 [ACK] Seq=240901 Ack=420 Win=15744 Len=1460 [TCP segment of a reassembled PDU]"
"241","3.696612","192.168.0.111","160.36.131.221","TCP","54","63780  >  80 [ACK] Seq=420 Ack=242361 Win=262656 Len=0"
"242","3.696912","160.36.131.221","192.168.0.111","TCP","1514","80  >  63780 [ACK] Seq=242361 Ack=420 Win=15744 Len=1460 [TCP segment of a reassembled PDU]"
"243","3.696912","160.36.131.221","192.168.0.111","TCP","1514","80  >  63780 [ACK] Seq=243821 Ack=420 Win=15744 Len=1460 [TCP segment of a reassembled PDU]"
"244","3.696912","160.36.131.221","192.168.0.111","TCP","1514","80  >  63780 [ACK] Seq=245281 Ack=420 Win=15744 Len=1460 [TCP segment of a reassembled PDU]"
"245","3.696912","160.36.131.221","192.168.0.111","TCP","1514","80  >  63780 [ACK] Seq=246741 Ack=420 Win=15744 Len=1460 [TCP segment of a reassembled PDU]"
"246","3.697047","192.168.0.111","160.36.131.221","TCP","54","63780  >  80 [ACK] Seq=420 Ack=248201 Win=262656 Len=0"
"247","3.697133","160.36.131.221","192.168.0.111","TCP","1514","80  >  63780 [ACK] Seq=248201 Ack=420 Win=15744 Len=1460 [TCP segment of a reassembled PDU]"
"248","3.697211","192.168.0.111","160.36.131.221","TCP","54","63780  >  80 [ACK] Seq=420 Ack=249661 Win=262656 Len=0"
"249","3.705337","160.36.131.221","192.168.0.111","TCP","1514","80  >  63780 [ACK] Seq=249661 Ack=420 Win=15744 Len=1460 [TCP segment of a reassembled PDU]"
"250","3.705394","160.36.131.221","192.168.0.111","TCP","1514","80  >  63780 [PSH, ACK] Seq=251121 Ack=420 Win=15744 Len=1460 [TCP segment of a reassembled PDU]"
"251","3.705533","192.168.0.111","160.36.131.221","TCP","54","63780  >  80 [ACK] Seq=420 Ack=252581 Win=262656 Len=0"
"252","3.753998","160.36.131.221","192.168.0.111","TCP","1514","80  >  63780 [ACK] Seq=252581 Ack=420 Win=15744 Len=1460 [TCP segment of a reassembled PDU]"
"253","3.754264","160.36.131.221","192.168.0.111","TCP","1514","80  >  63780 [ACK] Seq=254041 Ack=420 Win=15744 Len=1460 [TCP segment of a reassembled PDU]"
"254","3.754264","160.36.131.221","192.168.0.111","TCP","1514","80  >  63780 [ACK] Seq=255501 Ack=420 Win=15744 Len=1460 [TCP segment of a reassembled PDU]"
"255","3.754264","160.36.131.221","192.168.0.111","TCP","1514","80  >  63780 [ACK] Seq=256961 Ack=420 Win=15744 Len=1460 [TCP segment of a reassembled PDU]"
"256","3.754264","160.36.131.221","192.168.0.111","TCP","1514","80  >  63780 [ACK] Seq=258421 Ack=420 Win=15744 Len=1460 [TCP segment of a reassembled PDU]"
"257","3.754378","160.36.131.221","192.168.0.111","TCP","1514","80  >  63780 [ACK] Seq=259881 Ack=420 Win=15744 Len=1460 [TCP segment of a reassembled PDU]"
"258","3.754378","160.36.131.221","192.168.0.111","TCP","1514","80  >  63780 [ACK] Seq=261341 Ack=420 Win=15744 Len=1460 [TCP segment of a reassembled PDU]"
"259","3.754581","160.36.131.221","192.168.0.111","TCP","1514","80  >  63780 [ACK] Seq=262801 Ack=420 Win=15744 Len=1460 [TCP segment of a reassembled PDU]"
"260","3.754581","160.36.131.221","192.168.0.111","TCP","1514","80  >  63780 [ACK] Seq=264261 Ack=420 Win=15744 Len=1460 [TCP segment of a reassembled PDU]"
"261","3.754581","160.36.131.221","192.168.0.111","TCP","1514","80  >  63780 [ACK] Seq=265721 Ack=420 Win=15744 Len=1460 [TCP segment of a reassembled PDU]"
"262","3.754703","160.36.131.221","192.168.0.111","TCP","1514","80  >  63780 [ACK] Seq=267181 Ack=420 Win=15744 Len=1460 [TCP segment of a reassembled PDU]"
"263","3.754953","192.168.0.111","160.36.131.221","TCP","54","63780  >  80 [ACK] Seq=420 Ack=267181 Win=262656 Len=0"
"264","3.755117","160.36.131.221","192.168.0.111","TCP","1514","80  >  63780 [ACK] Seq=268641 Ack=420 Win=15744 Len=1460 [TCP segment of a reassembled PDU]"
"265","3.755117","160.36.131.221","192.168.0.111","TCP","1514","80  >  63780 [ACK] Seq=270101 Ack=420 Win=15744 Len=1460 [TCP segment of a reassembled PDU]"
"266","3.755117","160.36.131.221","192.168.0.111","TCP","1514","80  >  63780 [ACK] Seq=271561 Ack=420 Win=15744 Len=1460 [TCP segment of a reassembled PDU]"
"267","3.755117","160.36.131.221","192.168.0.111","TCP","1514","80  >  63780 [ACK] Seq=273021 Ack=420 Win=15744 Len=1460 [TCP segment of a reassembled PDU]"
"268","3.755270","160.36.131.221","192.168.0.111","TCP","1514","80  >  63780 [ACK] Seq=274481 Ack=420 Win=15744 Len=1460 [TCP segment of a reassembled PDU]"
"269","3.755270","160.36.131.221","192.168.0.111","TCP","1514","80  >  63780 [ACK] Seq=275941 Ack=420 Win=15744 Len=1460 [TCP segment of a reassembled PDU]"
"270","3.755572","160.36.131.221","192.168.0.111","TCP","1514","80  >  63780 [ACK] Seq=277401 Ack=420 Win=15744 Len=1460 [TCP segment of a reassembled PDU]"
"271","3.755572","160.36.131.221","192.168.0.111","TCP","1514","80  >  63780 [ACK] Seq=278861 Ack=420 Win=15744 Len=1460 [TCP segment of a reassembled PDU]"
"272","3.755670","160.36.131.221","192.168.0.111","TCP","1514","80  >  63780 [ACK] Seq=280321 Ack=420 Win=15744 Len=1460 [TCP segment of a reassembled PDU]"
"273","3.755670","160.36.131.221","192.168.0.111","TCP","1514","80  >  63780 [ACK] Seq=281781 Ack=420 Win=15744 Len=1460 [TCP segment of a reassembled PDU]"
"274","3.755670","160.36.131.221","192.168.0.111","TCP","1514","80  >  63780 [ACK] Seq=283241 Ack=420 Win=15744 Len=1460 [TCP segment of a reassembled PDU]"
"275","3.755670","160.36.131.221","192.168.0.111","TCP","1514","80  >  63780 [ACK] Seq=284701 Ack=420 Win=15744 Len=1460 [TCP segment of a reassembled PDU]"
"276","3.755670","160.36.131.221","192.168.0.111","TCP","1514","80  >  63780 [ACK] Seq=286161 Ack=420 Win=15744 Len=1460 [TCP segment of a reassembled PDU]"
"277","3.755776","160.36.131.221","192.168.0.111","TCP","1514","80  >  63780 [ACK] Seq=287621 Ack=420 Win=15744 Len=1460 [TCP segment of a reassembled PDU]"
"278","3.755906","160.36.131.221","192.168.0.111","TCP","1514","80  >  63780 [ACK] Seq=289081 Ack=420 Win=15744 Len=1460 [TCP segment of a reassembled PDU]"
"279","3.756082","160.36.131.221","192.168.0.111","TCP","1514","80  >  63780 [ACK] Seq=290541 Ack=420 Win=15744 Len=1460 [TCP segment of a reassembled PDU]"
"280","3.757808","192.168.0.111","160.36.131.221","TCP","54","63780  >  80 [ACK] Seq=420 Ack=281781 Win=262656 Len=0"
"281","3.757940","160.36.131.221","192.168.0.111","TCP","1514","80  >  63780 [ACK] Seq=292001 Ack=420 Win=15744 Len=1460 [TCP segment of a reassembled PDU]"
"282","3.757940","160.36.131.221","192.168.0.111","TCP","1514","80  >  63780 [ACK] Seq=293461 Ack=420 Win=15744 Len=1460 [TCP segment of a reassembled PDU]"
"283","3.757940","160.36.131.221","192.168.0.111","TCP","1514","80  >  63780 [ACK] Seq=294921 Ack=420 Win=15744 Len=1460 [TCP segment of a reassembled PDU]"
"284","3.757959","192.168.0.111","160.36.131.221","TCP","54","63780  >  80 [ACK] Seq=420 Ack=296381 Win=262656 Len=0"
"285","3.760535","160.36.131.221","192.168.0.111","TCP","1514","80  >  63780 [ACK] Seq=296381 Ack=420 Win=15744 Len=1460 [TCP segment of a reassembled PDU]"
"286","3.760844","160.36.131.221","192.168.0.111","TCP","1514","80  >  63780 [PSH, ACK] Seq=297841 Ack=420 Win=15744 Len=1460 [TCP segment of a reassembled PDU]"
"287","3.760897","192.168.0.111","160.36.131.221","TCP","54","63780  >  80 [ACK] Seq=420 Ack=299301 Win=262656 Len=0"
"288","3.770122","160.36.131.221","192.168.0.111","TCP","1514","80  >  63780 [ACK] Seq=299301 Ack=420 Win=15744 Len=1460 [TCP segment of a reassembled PDU]"
"289","3.770278","160.36.131.221","192.168.0.111","TCP","1514","80  >  63780 [ACK] Seq=300761 Ack=420 Win=15744 Len=1460 [TCP segment of a reassembled PDU]"
"290","3.770323","192.168.0.111","160.36.131.221","TCP","54","63780  >  80 [ACK] Seq=420 Ack=302221 Win=262656 Len=0"
"291","3.823308","160.36.131.221","192.168.0.111","TCP","1514","80  >  63780 [ACK] Seq=302221 Ack=420 Win=15744 Len=1460 [TCP segment of a reassembled PDU]"
"292","3.823595","160.36.131.221","192.168.0.111","TCP","1514","80  >  63780 [ACK] Seq=303681 Ack=420 Win=15744 Len=1460 [TCP segment of a reassembled PDU]"
