"No.","Time","Source","Destination","Protocol","Length","Info"
"1","0.000000","192.168.0.137","160.36.131.221","TCP","54","63582  >  80 [FIN, ACK] Seq=1 Ack=1 Win=513 Len=0"
"2","0.000126","192.168.0.137","160.36.131.221","TCP","54","63581  >  80 [FIN, ACK] Seq=1 Ack=1 Win=513 Len=0"
"18","0.077206","160.36.131.221","192.168.0.137","TCP","54","80  >  63582 [ACK] Seq=1 Ack=2 Win=123 Len=0"
"19","0.077206","160.36.131.221","192.168.0.137","TCP","54","80  >  63581 [ACK] Seq=1 Ack=2 Win=140 Len=0"
"5909","6.356084","192.168.0.137","160.36.131.221","TCP","66","63589  >  80 [SYN] Seq=0 Win=64240 Len=0 MSS=1460 WS=256 SACK_PERM=1"
"5910","6.356229","192.168.0.137","160.36.131.221","TCP","66","63590  >  80 [SYN] Seq=0 Win=64240 Len=0 MSS=1460 WS=256 SACK_PERM=1"
"5915","6.424841","160.36.131.221","192.168.0.137","TCP","66","80  >  63589 [SYN, ACK] Seq=0 Ack=1 Win=14600 Len=0 MSS=1460 SACK_PERM=1 WS=128"
"5916","6.424841","160.36.131.221","192.168.0.137","TCP","66","80  >  63590 [SYN, ACK] Seq=0 Ack=1 Win=14600 Len=0 MSS=1460 SACK_PERM=1 WS=128"
"5917","6.424935","192.168.0.137","160.36.131.221","TCP","54","63589  >  80 [ACK] Seq=1 Ack=1 Win=131328 Len=0"
"5918","6.424985","192.168.0.137","160.36.131.221","TCP","54","63590  >  80 [ACK] Seq=1 Ack=1 Win=131328 Len=0"
"5919","6.425196","192.168.0.137","160.36.131.221","HTTP","574","GET /lapack/lapack-3.8.0.tar.gz HTTP/1.1 "
"5927","6.508987","160.36.131.221","192.168.0.137","TCP","54","80  >  63590 [ACK] Seq=1 Ack=521 Win=15744 Len=0"
"5928","6.508987","160.36.131.221","192.168.0.137","TCP","1514","80  >  63590 [ACK] Seq=1 Ack=521 Win=15744 Len=1460 [TCP segment of a reassembled PDU]"
"5929","6.510779","160.36.131.221","192.168.0.137","TCP","1514","80  >  63590 [ACK] Seq=1461 Ack=521 Win=15744 Len=1460 [TCP segment of a reassembled PDU]"
"5930","6.510779","160.36.131.221","192.168.0.137","TCP","1514","80  >  63590 [ACK] Seq=2921 Ack=521 Win=15744 Len=1460 [TCP segment of a reassembled PDU]"
"5931","6.510779","160.36.131.221","192.168.0.137","TCP","1514","80  >  63590 [ACK] Seq=4381 Ack=521 Win=15744 Len=1460 [TCP segment of a reassembled PDU]"
"5932","6.510779","160.36.131.221","192.168.0.137","TCP","1514","80  >  63590 [ACK] Seq=5841 Ack=521 Win=15744 Len=1460 [TCP segment of a reassembled PDU]"
"5933","6.510779","160.36.131.221","192.168.0.137","TCP","1514","80  >  63590 [ACK] Seq=7301 Ack=521 Win=15744 Len=1460 [TCP segment of a reassembled PDU]"
"5934","6.510779","160.36.131.221","192.168.0.137","TCP","1514","80  >  63590 [ACK] Seq=8761 Ack=521 Win=15744 Len=1460 [TCP segment of a reassembled PDU]"
"5935","6.510779","160.36.131.221","192.168.0.137","TCP","1514","80  >  63590 [ACK] Seq=10221 Ack=521 Win=15744 Len=1460 [TCP segment of a reassembled PDU]"
"5936","6.510779","160.36.131.221","192.168.0.137","TCP","1514","80  >  63590 [ACK] Seq=11681 Ack=521 Win=15744 Len=1460 [TCP segment of a reassembled PDU]"
"5937","6.510779","160.36.131.221","192.168.0.137","TCP","1514","80  >  63590 [ACK] Seq=13141 Ack=521 Win=15744 Len=1460 [TCP segment of a reassembled PDU]"
"5938","6.510941","192.168.0.137","160.36.131.221","TCP","54","63590  >  80 [ACK] Seq=521 Ack=14601 Win=131328 Len=0"
"5942","6.576506","160.36.131.221","192.168.0.137","TCP","1514","80  >  63590 [ACK] Seq=14601 Ack=521 Win=15744 Len=1460 [TCP segment of a reassembled PDU]"
"5943","6.576506","160.36.131.221","192.168.0.137","TCP","1514","80  >  63590 [PSH, ACK] Seq=16061 Ack=521 Win=15744 Len=1460 [TCP segment of a reassembled PDU]"
"5944","6.576506","160.36.131.221","192.168.0.137","TCP","1514","80  >  63590 [ACK] Seq=17521 Ack=521 Win=15744 Len=1460 [TCP segment of a reassembled PDU]"
"5945","6.576506","160.36.131.221","192.168.0.137","TCP","1514","80  >  63590 [ACK] Seq=18981 Ack=521 Win=15744 Len=1460 [TCP segment of a reassembled PDU]"
"5946","6.576506","160.36.131.221","192.168.0.137","TCP","1514","80  >  63590 [ACK] Seq=20441 Ack=521 Win=15744 Len=1460 [TCP segment of a reassembled PDU]"
"5947","6.576506","160.36.131.221","192.168.0.137","TCP","1514","80  >  63590 [ACK] Seq=21901 Ack=521 Win=15744 Len=1460 [TCP segment of a reassembled PDU]"
"5948","6.576506","160.36.131.221","192.168.0.137","TCP","1514","80  >  63590 [ACK] Seq=23361 Ack=521 Win=15744 Len=1460 [TCP segment of a reassembled PDU]"
"5949","6.576506","160.36.131.221","192.168.0.137","TCP","1514","80  >  63590 [ACK] Seq=24821 Ack=521 Win=15744 Len=1460 [TCP segment of a reassembled PDU]"
"5950","6.576506","160.36.131.221","192.168.0.137","TCP","1514","80  >  63590 [ACK] Seq=26281 Ack=521 Win=15744 Len=1460 [TCP segment of a reassembled PDU]"
"5951","6.576506","160.36.131.221","192.168.0.137","TCP","1514","80  >  63590 [ACK] Seq=27741 Ack=521 Win=15744 Len=1460 [TCP segment of a reassembled PDU]"
"5952","6.576506","160.36.131.221","192.168.0.137","TCP","1514","80  >  63590 [ACK] Seq=29201 Ack=521 Win=15744 Len=1460 [TCP segment of a reassembled PDU]"
"5953","6.576587","192.168.0.137","160.36.131.221","TCP","54","63590  >  80 [ACK] Seq=521 Ack=30661 Win=131328 Len=0"
"5954","6.644428","160.36.131.221","192.168.0.137","TCP","1514","80  >  63590 [ACK] Seq=30661 Ack=521 Win=15744 Len=1460 [TCP segment of a reassembled PDU]"
"5955","6.644428","160.36.131.221","192.168.0.137","TCP","1514","80  >  63590 [ACK] Seq=32121 Ack=521 Win=15744 Len=1460 [TCP segment of a reassembled PDU]"
"5956","6.644428","160.36.131.221","192.168.0.137","TCP","1514","80  >  63590 [ACK] Seq=33581 Ack=521 Win=15744 Len=1460 [TCP segment of a reassembled PDU]"
"5957","6.644428","160.36.131.221","192.168.0.137","TCP","1514","80  >  63590 [ACK] Seq=35041 Ack=521 Win=15744 Len=1460 [TCP segment of a reassembled PDU]"
"5958","6.644428","160.36.131.221","192.168.0.137","TCP","1514","80  >  63590 [ACK] Seq=36501 Ack=521 Win=15744 Len=1460 [TCP segment of a reassembled PDU]"
"5959","6.644428","160.36.131.221","192.168.0.137","TCP","1514","80  >  63590 [ACK] Seq=37961 Ack=521 Win=15744 Len=1460 [TCP segment of a reassembled PDU]"
"5960","6.644428","160.36.131.221","192.168.0.137","TCP","1514","80  >  63590 [ACK] Seq=39421 Ack=521 Win=15744 Len=1460 [TCP segment of a reassembled PDU]"
"5961","6.644428","160.36.131.221","192.168.0.137","TCP","1514","80  >  63590 [ACK] Seq=40881 Ack=521 Win=15744 Len=1460 [TCP segment of a reassembled PDU]"
"5962","6.644428","160.36.131.221","192.168.0.137","TCP","1514","80  >  63590 [ACK] Seq=42341 Ack=521 Win=15744 Len=1460 [TCP segment of a reassembled PDU]"
"5963","6.644494","192.168.0.137","160.36.131.221","TCP","54","63590  >  80 [ACK] Seq=521 Ack=43801 Win=131328 Len=0"
"5964","6.645853","160.36.131.221","192.168.0.137","TCP","1514","80  >  63590 [ACK] Seq=43801 Ack=521 Win=15744 Len=1460 [TCP segment of a reassembled PDU]"
"5965","6.645853","160.36.131.221","192.168.0.137","TCP","1514","80  >  63590 [ACK] Seq=45261 Ack=521 Win=15744 Len=1460 [TCP segment of a reassembled PDU]"
"5966","6.645853","160.36.131.221","192.168.0.137","TCP","1514","80  >  63590 [ACK] Seq=46721 Ack=521 Win=15744 Len=1460 [TCP segment of a reassembled PDU]"
"5967","6.645885","192.168.0.137","160.36.131.221","TCP","54","63590  >  80 [ACK] Seq=521 Ack=48181 Win=131328 Len=0"
"5968","6.715719","160.36.131.221","192.168.0.137","TCP","1514","80  >  63590 [ACK] Seq=48181 Ack=521 Win=15744 Len=1460 [TCP segment of a reassembled PDU]"
"5969","6.715719","160.36.131.221","192.168.0.137","TCP","1514","80  >  63590 [PSH, ACK] Seq=49641 Ack=521 Win=15744 Len=1460 [TCP segment of a reassembled PDU]"
"5970","6.715719","160.36.131.221","192.168.0.137","TCP","1514","80  >  63590 [ACK] Seq=51101 Ack=521 Win=15744 Len=1460 [TCP segment of a reassembled PDU]"
"5971","6.715719","160.36.131.221","192.168.0.137","TCP","1514","80  >  63590 [ACK] Seq=52561 Ack=521 Win=15744 Len=1460 [TCP segment of a reassembled PDU]"
"5972","6.715719","160.36.131.221","192.168.0.137","TCP","1514","80  >  63590 [ACK] Seq=54021 Ack=521 Win=15744 Len=1460 [TCP segment of a reassembled PDU]"
"5973","6.715719","160.36.131.221","192.168.0.137","TCP","1514","80  >  63590 [ACK] Seq=55481 Ack=521 Win=15744 Len=1460 [TCP segment of a reassembled PDU]"
"5974","6.715719","160.36.131.221","192.168.0.137","TCP","1514","80  >  63590 [ACK] Seq=56941 Ack=521 Win=15744 Len=1460 [TCP segment of a reassembled PDU]"
"5975","6.715816","192.168.0.137","160.36.131.221","TCP","54","63590  >  80 [ACK] Seq=521 Ack=58401 Win=131328 Len=0"
"5976","6.717026","160.36.131.221","192.168.0.137","TCP","1514","80  >  63590 [ACK] Seq=58401 Ack=521 Win=15744 Len=1460 [TCP segment of a reassembled PDU]"
"5977","6.717026","160.36.131.221","192.168.0.137","TCP","1514","80  >  63590 [ACK] Seq=59861 Ack=521 Win=15744 Len=1460 [TCP segment of a reassembled PDU]"
"5978","6.717026","160.36.131.221","192.168.0.137","TCP","1514","80  >  63590 [ACK] Seq=61321 Ack=521 Win=15744 Len=1460 [TCP segment of a reassembled PDU]"
"5979","6.717026","160.36.131.221","192.168.0.137","TCP","1514","80  >  63590 [ACK] Seq=62781 Ack=521 Win=15744 Len=1460 [TCP segment of a reassembled PDU]"
"5980","6.717026","160.36.131.221","192.168.0.137","TCP","1514","80  >  63590 [ACK] Seq=64241 Ack=521 Win=15744 Len=1460 [TCP segment of a reassembled PDU]"
"5981","6.717026","160.36.131.221","192.168.0.137","TCP","1514","80  >  63590 [ACK] Seq=65701 Ack=521 Win=15744 Len=1460 [TCP segment of a reassembled PDU]"
"5982","6.717026","160.36.131.221","192.168.0.137","TCP","1514","80  >  63590 [PSH, ACK] Seq=67161 Ack=521 Win=15744 Len=1460 [TCP segment of a reassembled PDU]"
"5983","6.717072","192.168.0.137","160.36.131.221","TCP","54","63590  >  80 [ACK] Seq=521 Ack=68621 Win=131328 Len=0"
"5984","6.779339","160.36.131.221","192.168.0.137","TCP","1514","80  >  63590 [ACK] Seq=68621 Ack=521 Win=15744 Len=1460 [TCP segment of a reassembled PDU]"
"5985","6.779339","160.36.131.221","192.168.0.137","TCP","1514","80  >  63590 [ACK] Seq=70081 Ack=521 Win=15744 Len=1460 [TCP segment of a reassembled PDU]"
"5986","6.779339","160.36.131.221","192.168.0.137","TCP","1514","80  >  63590 [ACK] Seq=71541 Ack=521 Win=15744 Len=1460 [TCP segment of a reassembled PDU]"
"5987","6.779339","160.36.131.221","192.168.0.137","TCP","1514","80  >  63590 [ACK] Seq=73001 Ack=521 Win=15744 Len=1460 [TCP segment of a reassembled PDU]"
"5988","6.779339","160.36.131.221","192.168.0.137","TCP","1514","80  >  63590 [ACK] Seq=74461 Ack=521 Win=15744 Len=1460 [TCP segment of a reassembled PDU]"
"5989","6.779339","160.36.131.221","192.168.0.137","TCP","1514","80  >  63590 [ACK] Seq=75921 Ack=521 Win=15744 Len=1460 [TCP segment of a reassembled PDU]"
"5990","6.779410","192.168.0.137","160.36.131.221","TCP","54","63590  >  80 [ACK] Seq=521 Ack=77381 Win=131328 Len=0"
"5991","6.780558","160.36.131.221","192.168.0.137","TCP","1514","80  >  63590 [ACK] Seq=77381 Ack=521 Win=15744 Len=1460 [TCP segment of a reassembled PDU]"
"5992","6.780558","160.36.131.221","192.168.0.137","TCP","1514","80  >  63590 [ACK] Seq=78841 Ack=521 Win=15744 Len=1460 [TCP segment of a reassembled PDU]"
"5993","6.780624","192.168.0.137","160.36.131.221","TCP","54","63590  >  80 [ACK] Seq=521 Ack=80301 Win=131328 Len=0"
"5994","6.788202","160.36.131.221","192.168.0.137","TCP","1514","80  >  63590 [ACK] Seq=80301 Ack=521 Win=15744 Len=1460 [TCP segment of a reassembled PDU]"
"5995","6.788202","160.36.131.221","192.168.0.137","TCP","1514","80  >  63590 [ACK] Seq=81761 Ack=521 Win=15744 Len=1460 [TCP segment of a reassembled PDU]"
"5996","6.788202","160.36.131.221","192.168.0.137","TCP","1514","80  >  63590 [ACK] Seq=83221 Ack=521 Win=15744 Len=1460 [TCP segment of a reassembled PDU]"
"5997","6.788202","160.36.131.221","192.168.0.137","TCP","1514","80  >  63590 [PSH, ACK] Seq=84681 Ack=521 Win=15744 Len=1460 [TCP segment of a reassembled PDU]"
"5998","6.788202","160.36.131.221","192.168.0.137","TCP","1514","80  >  63590 [ACK] Seq=86141 Ack=521 Win=15744 Len=1460 [TCP segment of a reassembled PDU]"
"5999","6.788202","160.36.131.221","192.168.0.137","TCP","1514","80  >  63590 [ACK] Seq=87601 Ack=521 Win=15744 Len=1460 [TCP segment of a reassembled PDU]"
"6000","6.788202","160.36.131.221","192.168.0.137","TCP","1514","80  >  63590 [ACK] Seq=89061 Ack=521 Win=15744 Len=1460 [TCP segment of a reassembled PDU]"
"6001","6.788202","160.36.131.221","192.168.0.137","TCP","1514","80  >  63590 [ACK] Seq=90521 Ack=521 Win=15744 Len=1460 [TCP segment of a reassembled PDU]"
"6002","6.788313","192.168.0.137","160.36.131.221","TCP","54","63590  >  80 [ACK] Seq=521 Ack=91981 Win=131328 Len=0"
"6003","6.839451","160.36.131.221","192.168.0.137","TCP","1514","80  >  63590 [ACK] Seq=91981 Ack=521 Win=15744 Len=1460 [TCP segment of a reassembled PDU]"
"6004","6.839451","160.36.131.221","192.168.0.137","TCP","1514","80  >  63590 [ACK] Seq=93441 Ack=521 Win=15744 Len=1460 [TCP segment of a reassembled PDU]"
"6005","6.839451","160.36.131.221","192.168.0.137","TCP","1514","80  >  63590 [ACK] Seq=94901 Ack=521 Win=15744 Len=1460 [TCP segment of a reassembled PDU]"
"6006","6.839451","160.36.131.221","192.168.0.137","TCP","1514","80  >  63590 [ACK] Seq=96361 Ack=521 Win=15744 Len=1460 [TCP segment of a reassembled PDU]"
"6007","6.839451","160.36.131.221","192.168.0.137","TCP","1514","80  >  63590 [ACK] Seq=97821 Ack=521 Win=15744 Len=1460 [TCP segment of a reassembled PDU]"
"6008","6.839451","160.36.131.221","192.168.0.137","TCP","1514","80  >  63590 [ACK] Seq=99281 Ack=521 Win=15744 Len=1460 [TCP segment of a reassembled PDU]"
"6009","6.839451","160.36.131.221","192.168.0.137","TCP","1514","80  >  63590 [ACK] Seq=100741 Ack=521 Win=15744 Len=1460 [TCP segment of a reassembled PDU]"
"6010","6.839451","160.36.131.221","192.168.0.137","TCP","1514","80  >  63590 [ACK] Seq=102201 Ack=521 Win=15744 Len=1460 [TCP segment of a reassembled PDU]"
"6011","6.839451","160.36.131.221","192.168.0.137","TCP","1514","80  >  63590 [ACK] Seq=103661 Ack=521 Win=15744 Len=1460 [TCP segment of a reassembled PDU]"
"6012","6.839451","160.36.131.221","192.168.0.137","TCP","1514","80  >  63590 [ACK] Seq=105121 Ack=521 Win=15744 Len=1460 [TCP segment of a reassembled PDU]"
"6013","6.839546","192.168.0.137","160.36.131.221","TCP","54","63590  >  80 [ACK] Seq=521 Ack=106581 Win=131328 Len=0"
"6014","6.853096","160.36.131.221","192.168.0.137","TCP","1514","80  >  63590 [ACK] Seq=106581 Ack=521 Win=15744 Len=1460 [TCP segment of a reassembled PDU]"
"6015","6.853096","160.36.131.221","192.168.0.137","TCP","1514","80  >  63590 [ACK] Seq=108041 Ack=521 Win=15744 Len=1460 [TCP segment of a reassembled PDU]"
"6016","6.853096","160.36.131.221","192.168.0.137","TCP","1514","80  >  63590 [ACK] Seq=109501 Ack=521 Win=15744 Len=1460 [TCP segment of a reassembled PDU]"
"6017","6.853096","160.36.131.221","192.168.0.137","TCP","1514","80  >  63590 [ACK] Seq=110961 Ack=521 Win=15744 Len=1460 [TCP segment of a reassembled PDU]"
"6018","6.853096","160.36.131.221","192.168.0.137","TCP","1514","80  >  63590 [ACK] Seq=112421 Ack=521 Win=15744 Len=1460 [TCP segment of a reassembled PDU]"
"6019","6.853096","160.36.131.221","192.168.0.137","TCP","1514","80  >  63590 [ACK] Seq=113881 Ack=521 Win=15744 Len=1460 [TCP segment of a reassembled PDU]"
"6020","6.853096","160.36.131.221","192.168.0.137","TCP","1514","80  >  63590 [ACK] Seq=115341 Ack=521 Win=15744 Len=1460 [TCP segment of a reassembled PDU]"
"6021","6.853096","160.36.131.221","192.168.0.137","TCP","1514","80  >  63590 [ACK] Seq=116801 Ack=521 Win=15744 Len=1460 [TCP segment of a reassembled PDU]"
"6022","6.853162","192.168.0.137","160.36.131.221","TCP","54","63590  >  80 [ACK] Seq=521 Ack=118261 Win=131328 Len=0"
"6023","6.927135","160.36.131.221","192.168.0.137","TCP","1514","80  >  63590 [ACK] Seq=118261 Ack=521 Win=15744 Len=1460 [TCP segment of a reassembled PDU]"
"6024","6.927135","160.36.131.221","192.168.0.137","TCP","1514","80  >  63590 [ACK] Seq=119721 Ack=521 Win=15744 Len=1460 [TCP segment of a reassembled PDU]"
"6025","6.927135","160.36.131.221","192.168.0.137","TCP","1514","80  >  63590 [ACK] Seq=121181 Ack=521 Win=15744 Len=1460 [TCP segment of a reassembled PDU]"
"6026","6.927135","160.36.131.221","192.168.0.137","TCP","1514","80  >  63590 [PSH, ACK] Seq=122641 Ack=521 Win=15744 Len=1460 [TCP segment of a reassembled PDU]"
"6027","6.927135","160.36.131.221","192.168.0.137","TCP","1514","80  >  63590 [ACK] Seq=124101 Ack=521 Win=15744 Len=1460 [TCP segment of a reassembled PDU]"
"6028","6.927135","160.36.131.221","192.168.0.137","TCP","1514","80  >  63590 [ACK] Seq=125561 Ack=521 Win=15744 Len=1460 [TCP segment of a reassembled PDU]"
"6029","6.927135","160.36.131.221","192.168.0.137","TCP","1514","80  >  63590 [ACK] Seq=127021 Ack=521 Win=15744 Len=1460 [TCP segment of a reassembled PDU]"
"6030","6.927135","160.36.131.221","192.168.0.137","TCP","1514","80  >  63590 [ACK] Seq=128481 Ack=521 Win=15744 Len=1460 [TCP segment of a reassembled PDU]"
"6031","6.927135","160.36.131.221","192.168.0.137","TCP","1514","80  >  63590 [ACK] Seq=129941 Ack=521 Win=15744 Len=1460 [TCP segment of a reassembled PDU]"
"6032","6.927135","160.36.131.221","192.168.0.137","TCP","1514","80  >  63590 [ACK] Seq=131401 Ack=521 Win=15744 Len=1460 [TCP segment of a reassembled PDU]"
"6033","6.927135","160.36.131.221","192.168.0.137","TCP","1514","80  >  63590 [ACK] Seq=132861 Ack=521 Win=15744 Len=1460 [TCP segment of a reassembled PDU]"
"6034","6.927135","160.36.131.221","192.168.0.137","TCP","1514","80  >  63590 [ACK] Seq=134321 Ack=521 Win=15744 Len=1460 [TCP segment of a reassembled PDU]"
"6035","6.927229","192.168.0.137","160.36.131.221","TCP","54","63590  >  80 [ACK] Seq=521 Ack=135781 Win=131328 Len=0"
"6036","6.934851","160.36.131.221","192.168.0.137","TCP","1514","80  >  63590 [ACK] Seq=135781 Ack=521 Win=15744 Len=1460 [TCP segment of a reassembled PDU]"
"6037","6.934851","160.36.131.221","192.168.0.137","TCP","1514","80  >  63590 [ACK] Seq=137241 Ack=521 Win=15744 Len=1460 [TCP segment of a reassembled PDU]"
"6038","6.934851","160.36.131.221","192.168.0.137","TCP","1514","80  >  63590 [ACK] Seq=138701 Ack=521 Win=15744 Len=1460 [TCP segment of a reassembled PDU]"
"6039","6.934851","160.36.131.221","192.168.0.137","TCP","1514","80  >  63590 [ACK] Seq=140161 Ack=521 Win=15744 Len=1460 [TCP segment of a reassembled PDU]"
"6040","6.934851","160.36.131.221","192.168.0.137","TCP","1514","80  >  63590 [ACK] Seq=141621 Ack=521 Win=15744 Len=1460 [TCP segment of a reassembled PDU]"
"6041","6.934851","160.36.131.221","192.168.0.137","TCP","1514","80  >  63590 [ACK] Seq=143081 Ack=521 Win=15744 Len=1460 [TCP segment of a reassembled PDU]"
"6042","6.934851","160.36.131.221","192.168.0.137","TCP","1514","80  >  63590 [ACK] Seq=144541 Ack=521 Win=15744 Len=1460 [TCP segment of a reassembled PDU]"
"6043","6.934851","160.36.131.221","192.168.0.137","TCP","1514","80  >  63590 [ACK] Seq=146001 Ack=521 Win=15744 Len=1460 [TCP segment of a reassembled PDU]"
"6044","6.934918","192.168.0.137","160.36.131.221","TCP","54","63590  >  80 [ACK] Seq=521 Ack=147461 Win=131328 Len=0"
"6047","6.992880","160.36.131.221","192.168.0.137","TCP","1514","80  >  63590 [ACK] Seq=147461 Ack=521 Win=15744 Len=1460 [TCP segment of a reassembled PDU]"
"6048","6.992880","160.36.131.221","192.168.0.137","TCP","1514","80  >  63590 [ACK] Seq=148921 Ack=521 Win=15744 Len=1460 [TCP segment of a reassembled PDU]"
"6049","6.992880","160.36.131.221","192.168.0.137","TCP","1514","80  >  63590 [ACK] Seq=150381 Ack=521 Win=15744 Len=1460 [TCP segment of a reassembled PDU]"
"6050","6.992880","160.36.131.221","192.168.0.137","TCP","1514","80  >  63590 [ACK] Seq=151841 Ack=521 Win=15744 Len=1460 [TCP segment of a reassembled PDU]"
"6051","6.992880","160.36.131.221","192.168.0.137","TCP","1514","80  >  63590 [ACK] Seq=153301 Ack=521 Win=15744 Len=1460 [TCP segment of a reassembled PDU]"
"6052","6.992880","160.36.131.221","192.168.0.137","TCP","1514","80  >  63590 [PSH, ACK] Seq=154761 Ack=521 Win=15744 Len=1460 [TCP segment of a reassembled PDU]"
"6053","6.992880","160.36.131.221","192.168.0.137","TCP","1514","80  >  63590 [ACK] Seq=156221 Ack=521 Win=15744 Len=1460 [TCP segment of a reassembled PDU]"
"6054","6.992880","160.36.131.221","192.168.0.137","TCP","1514","80  >  63590 [ACK] Seq=157681 Ack=521 Win=15744 Len=1460 [TCP segment of a reassembled PDU]"
"6055","6.992880","160.36.131.221","192.168.0.137","TCP","1514","80  >  63590 [ACK] Seq=159141 Ack=521 Win=15744 Len=1460 [TCP segment of a reassembled PDU]"
"6056","6.992880","160.36.131.221","192.168.0.137","TCP","1514","80  >  63590 [ACK] Seq=160601 Ack=521 Win=15744 Len=1460 [TCP segment of a reassembled PDU]"
"6057","6.992880","160.36.131.221","192.168.0.137","TCP","1514","80  >  63590 [ACK] Seq=162061 Ack=521 Win=15744 Len=1460 [TCP segment of a reassembled PDU]"
"6058","6.992880","160.36.131.221","192.168.0.137","TCP","1514","80  >  63590 [ACK] Seq=163521 Ack=521 Win=15744 Len=1460 [TCP segment of a reassembled PDU]"
"6059","6.992958","192.168.0.137","160.36.131.221","TCP","54","63590  >  80 [ACK] Seq=521 Ack=164981 Win=131328 Len=0"
"6060","6.994101","160.36.131.221","192.168.0.137","TCP","1514","80  >  63590 [ACK] Seq=164981 Ack=521 Win=15744 Len=1460 [TCP segment of a reassembled PDU]"
"6061","6.994101","160.36.131.221","192.168.0.137","TCP","1514","80  >  63590 [ACK] Seq=166441 Ack=521 Win=15744 Len=1460 [TCP segment of a reassembled PDU]"
"6062","6.994124","192.168.0.137","160.36.131.221","TCP","54","63590  >  80 [ACK] Seq=521 Ack=167901 Win=131328 Len=0"
"6063","7.069938","160.36.131.221","192.168.0.137","TCP","1514","80  >  63590 [ACK] Seq=167901 Ack=521 Win=15744 Len=1460 [TCP segment of a reassembled PDU]"
"6064","7.069938","160.36.131.221","192.168.0.137","TCP","1514","80  >  63590 [ACK] Seq=169361 Ack=521 Win=15744 Len=1460 [TCP segment of a reassembled PDU]"
"6065","7.069938","160.36.131.221","192.168.0.137","TCP","1514","80  >  63590 [ACK] Seq=170821 Ack=521 Win=15744 Len=1460 [TCP segment of a reassembled PDU]"
"6066","7.069938","160.36.131.221","192.168.0.137","TCP","1514","80  >  63590 [ACK] Seq=172281 Ack=521 Win=15744 Len=1460 [TCP segment of a reassembled PDU]"
"6067","7.069938","160.36.131.221","192.168.0.137","TCP","1514","80  >  63590 [ACK] Seq=173741 Ack=521 Win=15744 Len=1460 [TCP segment of a reassembled PDU]"
"6068","7.069938","160.36.131.221","192.168.0.137","TCP","1514","80  >  63590 [ACK] Seq=175201 Ack=521 Win=15744 Len=1460 [TCP segment of a reassembled PDU]"
"6069","7.069938","160.36.131.221","192.168.0.137","TCP","1514","80  >  63590 [ACK] Seq=176661 Ack=521 Win=15744 Len=1460 [TCP segment of a reassembled PDU]"
"6070","7.069938","160.36.131.221","192.168.0.137","TCP","1514","80  >  63590 [ACK] Seq=178121 Ack=521 Win=15744 Len=1460 [TCP segment of a reassembled PDU]"
"6071","7.069938","160.36.131.221","192.168.0.137","TCP","1514","80  >  63590 [ACK] Seq=179581 Ack=521 Win=15744 Len=1460 [TCP segment of a reassembled PDU]"
"6072","7.069938","160.36.131.221","192.168.0.137","TCP","1514","80  >  63590 [ACK] Seq=181041 Ack=521 Win=15744 Len=1460 [TCP segment of a reassembled PDU]"
"6073","7.069938","160.36.131.221","192.168.0.137","TCP","1514","80  >  63590 [ACK] Seq=182501 Ack=521 Win=15744 Len=1460 [TCP segment of a reassembled PDU]"
"6074","7.069938","160.36.131.221","192.168.0.137","TCP","1514","80  >  63590 [ACK] Seq=183961 Ack=521 Win=15744 Len=1460 [TCP segment of a reassembled PDU]"
"6075","7.069938","160.36.131.221","192.168.0.137","TCP","1514","80  >  63590 [ACK] Seq=185421 Ack=521 Win=15744 Len=1460 [TCP segment of a reassembled PDU]"
"6076","7.069938","160.36.131.221","192.168.0.137","TCP","1514","80  >  63590 [PSH, ACK] Seq=186881 Ack=521 Win=15744 Len=1460 [TCP segment of a reassembled PDU]"
"6077","7.069938","160.36.131.221","192.168.0.137","TCP","1514","80  >  63590 [ACK] Seq=188341 Ack=521 Win=15744 Len=1460 [TCP segment of a reassembled PDU]"
"6078","7.069938","160.36.131.221","192.168.0.137","TCP","1514","80  >  63590 [ACK] Seq=189801 Ack=521 Win=15744 Len=1460 [TCP segment of a reassembled PDU]"
"6079","7.070058","192.168.0.137","160.36.131.221","TCP","54","63590  >  80 [ACK] Seq=521 Ack=191261 Win=131328 Len=0"
"6080","7.071200","160.36.131.221","192.168.0.137","TCP","1514","80  >  63590 [ACK] Seq=191261 Ack=521 Win=15744 Len=1460 [TCP segment of a reassembled PDU]"
"6081","7.071200","160.36.131.221","192.168.0.137","TCP","1514","80  >  63590 [ACK] Seq=192721 Ack=521 Win=15744 Len=1460 [TCP segment of a reassembled PDU]"
"6082","7.071200","160.36.131.221","192.168.0.137","TCP","1514","80  >  63590 [ACK] Seq=194181 Ack=521 Win=15744 Len=1460 [TCP segment of a reassembled PDU]"
"6083","7.071200","160.36.131.221","192.168.0.137","TCP","1514","80  >  63590 [ACK] Seq=195641 Ack=521 Win=15744 Len=1460 [TCP segment of a reassembled PDU]"
"6084","7.071200","160.36.131.221","192.168.0.137","TCP","1514","80  >  63590 [ACK] Seq=197101 Ack=521 Win=15744 Len=1460 [TCP segment of a reassembled PDU]"
"6085","7.071262","192.168.0.137","160.36.131.221","TCP","54","63590  >  80 [ACK] Seq=521 Ack=198561 Win=131328 Len=0"
"6086","7.077522","160.36.131.221","192.168.0.137","TCP","1514","80  >  63590 [ACK] Seq=198561 Ack=521 Win=15744 Len=1460 [TCP segment of a reassembled PDU]"
"6087","7.077522","160.36.131.221","192.168.0.137","TCP","1514","80  >  63590 [ACK] Seq=200021 Ack=521 Win=15744 Len=1460 [TCP segment of a reassembled PDU]"
"6088","7.077580","192.168.0.137","160.36.131.221","TCP","54","63590  >  80 [ACK] Seq=521 Ack=201481 Win=131328 Len=0"
"6089","7.138336","160.36.131.221","192.168.0.137","TCP","1514","80  >  63590 [ACK] Seq=201481 Ack=521 Win=15744 Len=1460 [TCP segment of a reassembled PDU]"
"6090","7.138336","160.36.131.221","192.168.0.137","TCP","1514","80  >  63590 [ACK] Seq=202941 Ack=521 Win=15744 Len=1460 [TCP segment of a reassembled PDU]"
"6091","7.138336","160.36.131.221","192.168.0.137","TCP","1514","80  >  63590 [ACK] Seq=204401 Ack=521 Win=15744 Len=1460 [TCP segment of a reassembled PDU]"
"6092","7.138336","160.36.131.221","192.168.0.137","TCP","1514","80  >  63590 [ACK] Seq=205861 Ack=521 Win=15744 Len=1460 [TCP segment of a reassembled PDU]"
"6093","7.138336","160.36.131.221","192.168.0.137","TCP","1514","80  >  63590 [ACK] Seq=207321 Ack=521 Win=15744 Len=1460 [TCP segment of a reassembled PDU]"
"6094","7.138336","160.36.131.221","192.168.0.137","TCP","1514","80  >  63590 [ACK] Seq=208781 Ack=521 Win=15744 Len=1460 [TCP segment of a reassembled PDU]"
"6095","7.138336","160.36.131.221","192.168.0.137","TCP","1514","80  >  63590 [ACK] Seq=210241 Ack=521 Win=15744 Len=1460 [TCP segment of a reassembled PDU]"
"6096","7.138336","160.36.131.221","192.168.0.137","TCP","1514","80  >  63590 [ACK] Seq=211701 Ack=521 Win=15744 Len=1460 [TCP segment of a reassembled PDU]"
"6097","7.138336","160.36.131.221","192.168.0.137","TCP","1514","80  >  63590 [ACK] Seq=213161 Ack=521 Win=15744 Len=1460 [TCP segment of a reassembled PDU]"
"6098","7.138336","160.36.131.221","192.168.0.137","TCP","1514","80  >  63590 [ACK] Seq=214621 Ack=521 Win=15744 Len=1460 [TCP segment of a reassembled PDU]"
"6099","7.138336","160.36.131.221","192.168.0.137","TCP","1514","80  >  63590 [ACK] Seq=216081 Ack=521 Win=15744 Len=1460 [TCP segment of a reassembled PDU]"
"6100","7.138422","192.168.0.137","160.36.131.221","TCP","54","63590  >  80 [ACK] Seq=521 Ack=217541 Win=131328 Len=0"
"6101","7.139837","160.36.131.221","192.168.0.137","TCP","1514","80  >  63590 [ACK] Seq=217541 Ack=521 Win=15744 Len=1460 [TCP segment of a reassembled PDU]"
"6102","7.139837","160.36.131.221","192.168.0.137","TCP","1514","80  >  63590 [ACK] Seq=219001 Ack=521 Win=15744 Len=1460 [TCP segment of a reassembled PDU]"
"6103","7.139837","160.36.131.221","192.168.0.137","TCP","1514","80  >  63590 [ACK] Seq=220461 Ack=521 Win=15744 Len=1460 [TCP segment of a reassembled PDU]"
"6104","7.139837","160.36.131.221","192.168.0.137","TCP","1514","80  >  63590 [ACK] Seq=221921 Ack=521 Win=15744 Len=1460 [TCP segment of a reassembled PDU]"
"6105","7.139837","160.36.131.221","192.168.0.137","TCP","1514","80  >  63590 [ACK] Seq=223381 Ack=521 Win=15744 Len=1460 [TCP segment of a reassembled PDU]"
"6106","7.139837","160.36.131.221","192.168.0.137","TCP","1514","80  >  63590 [ACK] Seq=224841 Ack=521 Win=15744 Len=1460 [TCP segment of a reassembled PDU]"
"6107","7.139837","160.36.131.221","192.168.0.137","TCP","1514","80  >  63590 [ACK] Seq=226301 Ack=521 Win=15744 Len=1460 [TCP segment of a reassembled PDU]"
"6108","7.139837","160.36.131.221","192.168.0.137","TCP","1514","80  >  63590 [ACK] Seq=227761 Ack=521 Win=15744 Len=1460 [TCP segment of a reassembled PDU]"
"6109","7.139837","160.36.131.221","192.168.0.137","TCP","1514","80  >  63590 [ACK] Seq=229221 Ack=521 Win=15744 Len=1460 [TCP segment of a reassembled PDU]"
"6110","7.139837","160.36.131.221","192.168.0.137","TCP","1514","80  >  63590 [ACK] Seq=230681 Ack=521 Win=15744 Len=1460 [TCP segment of a reassembled PDU]"
"6111","7.139837","160.36.131.221","192.168.0.137","TCP","1514","80  >  63590 [ACK] Seq=232141 Ack=521 Win=15744 Len=1460 [TCP segment of a reassembled PDU]"
"6112","7.139837","160.36.131.221","192.168.0.137","TCP","1514","80  >  63590 [ACK] Seq=233601 Ack=521 Win=15744 Len=1460 [TCP segment of a reassembled PDU]"
"6113","7.139837","160.36.131.221","192.168.0.137","TCP","1514","80  >  63590 [ACK] Seq=235061 Ack=521 Win=15744 Len=1460 [TCP segment of a reassembled PDU]"
"6114","7.139924","192.168.0.137","160.36.131.221","TCP","54","63590  >  80 [ACK] Seq=521 Ack=236521 Win=131328 Len=0"
"6115","7.145789","160.36.131.221","192.168.0.137","TCP","1514","80  >  63590 [ACK] Seq=236521 Ack=521 Win=15744 Len=1460 [TCP segment of a reassembled PDU]"
"6116","7.145789","160.36.131.221","192.168.0.137","TCP","1514","80  >  63590 [ACK] Seq=237981 Ack=521 Win=15744 Len=1460 [TCP segment of a reassembled PDU]"
"6117","7.145842","192.168.0.137","160.36.131.221","TCP","54","63590  >  80 [ACK] Seq=521 Ack=239441 Win=131328 Len=0"
"6118","7.197911","160.36.131.221","192.168.0.137","TCP","1514","80  >  63590 [ACK] Seq=239441 Ack=521 Win=15744 Len=1460 [TCP segment of a reassembled PDU]"
"6119","7.197911","160.36.131.221","192.168.0.137","TCP","1514","80  >  63590 [PSH, ACK] Seq=240901 Ack=521 Win=15744 Len=1460 [TCP segment of a reassembled PDU]"
"6120","7.197911","160.36.131.221","192.168.0.137","TCP","1514","80  >  63590 [ACK] Seq=242361 Ack=521 Win=15744 Len=1460 [TCP segment of a reassembled PDU]"
"6121","7.197911","160.36.131.221","192.168.0.137","TCP","1514","80  >  63590 [ACK] Seq=243821 Ack=521 Win=15744 Len=1460 [TCP segment of a reassembled PDU]"
"6122","7.197998","192.168.0.137","160.36.131.221","TCP","54","63590  >  80 [ACK] Seq=521 Ack=245281 Win=131328 Len=0"
"6123","7.199862","160.36.131.221","192.168.0.137","TCP","1514","80  >  63590 [ACK] Seq=245281 Ack=521 Win=15744 Len=1460 [TCP segment of a reassembled PDU]"
"6124","7.199862","160.36.131.221","192.168.0.137","TCP","1514","80  >  63590 [ACK] Seq=246741 Ack=521 Win=15744 Len=1460 [TCP segment of a reassembled PDU]"
"6125","7.199862","160.36.131.221","192.168.0.137","TCP","1514","80  >  63590 [ACK] Seq=248201 Ack=521 Win=15744 Len=1460 [TCP segment of a reassembled PDU]"
"6126","7.199862","160.36.131.221","192.168.0.137","TCP","1514","80  >  63590 [ACK] Seq=249661 Ack=521 Win=15744 Len=1460 [TCP segment of a reassembled PDU]"
"6127","7.199862","160.36.131.221","192.168.0.137","TCP","1514","80  >  63590 [ACK] Seq=251121 Ack=521 Win=15744 Len=1460 [TCP segment of a reassembled PDU]"
"6128","7.199862","160.36.131.221","192.168.0.137","TCP","1514","80  >  63590 [ACK] Seq=252581 Ack=521 Win=15744 Len=1460 [TCP segment of a reassembled PDU]"
"6129","7.199862","160.36.131.221","192.168.0.137","TCP","1514","80  >  63590 [ACK] Seq=254041 Ack=521 Win=15744 Len=1460 [TCP segment of a reassembled PDU]"
"6130","7.199862","160.36.131.221","192.168.0.137","TCP","1514","80  >  63590 [ACK] Seq=255501 Ack=521 Win=15744 Len=1460 [TCP segment of a reassembled PDU]"
"6131","7.199862","160.36.131.221","192.168.0.137","TCP","1514","80  >  63590 [ACK] Seq=256961 Ack=521 Win=15744 Len=1460 [TCP segment of a reassembled PDU]"
"6132","7.199862","160.36.131.221","192.168.0.137","TCP","1514","80  >  63590 [ACK] Seq=258421 Ack=521 Win=15744 Len=1460 [TCP segment of a reassembled PDU]"
"6133","7.199862","160.36.131.221","192.168.0.137","TCP","1514","80  >  63590 [ACK] Seq=259881 Ack=521 Win=15744 Len=1460 [TCP segment of a reassembled PDU]"
"6134","7.199862","160.36.131.221","192.168.0.137","TCP","1514","80  >  63590 [ACK] Seq=261341 Ack=521 Win=15744 Len=1460 [TCP segment of a reassembled PDU]"
"6135","7.199862","160.36.131.221","192.168.0.137","TCP","1514","80  >  63590 [ACK] Seq=262801 Ack=521 Win=15744 Len=1460 [TCP segment of a reassembled PDU]"
"6136","7.199862","160.36.131.221","192.168.0.137","TCP","1514","80  >  63590 [ACK] Seq=264261 Ack=521 Win=15744 Len=1460 [TCP segment of a reassembled PDU]"
"6137","7.199862","160.36.131.221","192.168.0.137","TCP","1514","80  >  63590 [ACK] Seq=265721 Ack=521 Win=15744 Len=1460 [TCP segment of a reassembled PDU]"
"6138","7.199862","160.36.131.221","192.168.0.137","TCP","1514","80  >  63590 [ACK] Seq=267181 Ack=521 Win=15744 Len=1460 [TCP segment of a reassembled PDU]"
"6139","7.199862","160.36.131.221","192.168.0.137","TCP","1514","80  >  63590 [ACK] Seq=268641 Ack=521 Win=15744 Len=1460 [TCP segment of a reassembled PDU]"
"6140","7.199862","160.36.131.221","192.168.0.137","TCP","1514","80  >  63590 [ACK] Seq=270101 Ack=521 Win=15744 Len=1460 [TCP segment of a reassembled PDU]"
"6141","7.199862","160.36.131.221","192.168.0.137","TCP","1514","80  >  63590 [ACK] Seq=271561 Ack=521 Win=15744 Len=1460 [TCP segment of a reassembled PDU]"
"6142","7.200274","192.168.0.137","160.36.131.221","TCP","54","63590  >  80 [ACK] Seq=521 Ack=273021 Win=131328 Len=0"
"6143","7.201021","160.36.131.221","192.168.0.137","TCP","1514","80  >  63590 [ACK] Seq=273021 Ack=521 Win=15744 Len=1460 [TCP segment of a reassembled PDU]"
"6144","7.201021","160.36.131.221","192.168.0.137","TCP","1514","80  >  63590 [ACK] Seq=274481 Ack=521 Win=15744 Len=1460 [TCP segment of a reassembled PDU]"
"6145","7.201021","160.36.131.221","192.168.0.137","TCP","1514","80  >  63590 [ACK] Seq=275941 Ack=521 Win=15744 Len=1460 [TCP segment of a reassembled PDU]"
"6146","7.201129","192.168.0.137","160.36.131.221","TCP","54","63590  >  80 [ACK] Seq=521 Ack=277401 Win=131328 Len=0"
"6147","7.204244","160.36.131.221","192.168.0.137","TCP","1514","80  >  63590 [ACK] Seq=277401 Ack=521 Win=15744 Len=1460 [TCP segment of a reassembled PDU]"
"6148","7.204244","160.36.131.221","192.168.0.137","TCP","1514","80  >  63590 [PSH, ACK] Seq=278861 Ack=521 Win=15744 Len=1460 [TCP segment of a reassembled PDU]"
"6149","7.204321","192.168.0.137","160.36.131.221","TCP","54","63590  >  80 [ACK] Seq=521 Ack=280321 Win=131328 Len=0"
"6150","7.266096","160.36.131.221","192.168.0.137","TCP","1514","80  >  63590 [ACK] Seq=280321 Ack=521 Win=15744 Len=1460 [TCP segment of a reassembled PDU]"
"6151","7.266096","160.36.131.221","192.168.0.137","TCP","1514","80  >  63590 [ACK] Seq=281781 Ack=521 Win=15744 Len=1460 [TCP segment of a reassembled PDU]"
"6152","7.266096","160.36.131.221","192.168.0.137","TCP","1514","80  >  63590 [ACK] Seq=283241 Ack=521 Win=15744 Len=1460 [TCP segment of a reassembled PDU]"
"6153","7.266096","160.36.131.221","192.168.0.137","TCP","1514","80  >  63590 [ACK] Seq=284701 Ack=521 Win=15744 Len=1460 [TCP segment of a reassembled PDU]"
"6154","7.266096","160.36.131.221","192.168.0.137","TCP","1514","80  >  63590 [ACK] Seq=286161 Ack=521 Win=15744 Len=1460 [TCP segment of a reassembled PDU]"
"6155","7.266096","160.36.131.221","192.168.0.137","TCP","1514","80  >  63590 [ACK] Seq=287621 Ack=521 Win=15744 Len=1460 [TCP segment of a reassembled PDU]"
"6156","7.266096","160.36.131.221","192.168.0.137","TCP","1514","80  >  63590 [ACK] Seq=289081 Ack=521 Win=15744 Len=1460 [TCP segment of a reassembled PDU]"
"6157","7.266096","160.36.131.221","192.168.0.137","TCP","1514","80  >  63590 [ACK] Seq=290541 Ack=521 Win=15744 Len=1460 [TCP segment of a reassembled PDU]"
"6158","7.266096","160.36.131.221","192.168.0.137","TCP","1514","80  >  63590 [ACK] Seq=292001 Ack=521 Win=15744 Len=1460 [TCP segment of a reassembled PDU]"
"6159","7.266096","160.36.131.221","192.168.0.137","TCP","1514","80  >  63590 [ACK] Seq=293461 Ack=521 Win=15744 Len=1460 [TCP segment of a reassembled PDU]"
"6160","7.266263","192.168.0.137","160.36.131.221","TCP","54","63590  >  80 [ACK] Seq=521 Ack=294921 Win=131328 Len=0"
"6161","7.268230","160.36.131.221","192.168.0.137","TCP","1514","80  >  63590 [ACK] Seq=294921 Ack=521 Win=15744 Len=1460 [TCP segment of a reassembled PDU]"
"6162","7.268230","160.36.131.221","192.168.0.137","TCP","1514","80  >  63590 [ACK] Seq=296381 Ack=521 Win=15744 Len=1460 [TCP segment of a reassembled PDU]"
"6163","7.268230","160.36.131.221","192.168.0.137","TCP","1514","80  >  63590 [ACK] Seq=297841 Ack=521 Win=15744 Len=1460 [TCP segment of a reassembled PDU]"
"6164","7.268230","160.36.131.221","192.168.0.137","TCP","1514","80  >  63590 [ACK] Seq=299301 Ack=521 Win=15744 Len=1460 [TCP segment of a reassembled PDU]"
"6165","7.268230","160.36.131.221","192.168.0.137","TCP","1514","80  >  63590 [ACK] Seq=300761 Ack=521 Win=15744 Len=1460 [TCP segment of a reassembled PDU]"
"6166","7.268230","160.36.131.221","192.168.0.137","TCP","1514","80  >  63590 [ACK] Seq=302221 Ack=521 Win=15744 Len=1460 [TCP segment of a reassembled PDU]"
"6167","7.268230","160.36.131.221","192.168.0.137","TCP","1514","80  >  63590 [ACK] Seq=303681 Ack=521 Win=15744 Len=1460 [TCP segment of a reassembled PDU]"
"6168","7.268230","160.36.131.221","192.168.0.137","TCP","1514","80  >  63590 [ACK] Seq=305141 Ack=521 Win=15744 Len=1460 [TCP segment of a reassembled PDU]"
"6169","7.268230","160.36.131.221","192.168.0.137","TCP","1514","80  >  63590 [ACK] Seq=306601 Ack=521 Win=15744 Len=1460 [TCP segment of a reassembled PDU]"
"6170","7.268230","160.36.131.221","192.168.0.137","TCP","1514","80  >  63590 [ACK] Seq=308061 Ack=521 Win=15744 Len=1460 [TCP segment of a reassembled PDU]"
"6171","7.268230","160.36.131.221","192.168.0.137","TCP","1514","80  >  63590 [ACK] Seq=309521 Ack=521 Win=15744 Len=1460 [TCP segment of a reassembled PDU]"
"6172","7.268230","160.36.131.221","192.168.0.137","TCP","1514","80  >  63590 [ACK] Seq=310981 Ack=521 Win=15744 Len=1460 [TCP segment of a reassembled PDU]"
"6173","7.268230","160.36.131.221","192.168.0.137","TCP","1514","80  >  63590 [ACK] Seq=312441 Ack=521 Win=15744 Len=1460 [TCP segment of a reassembled PDU]"
"6174","7.268230","160.36.131.221","192.168.0.137","TCP","1514","80  >  63590 [ACK] Seq=313901 Ack=521 Win=15744 Len=1460 [TCP segment of a reassembled PDU]"
"6175","7.268230","160.36.131.221","192.168.0.137","TCP","1514","80  >  63590 [ACK] Seq=315361 Ack=521 Win=15744 Len=1460 [TCP segment of a reassembled PDU]"
"6176","7.268230","160.36.131.221","192.168.0.137","TCP","1514","80  >  63590 [ACK] Seq=316821 Ack=521 Win=15744 Len=1460 [TCP segment of a reassembled PDU]"
"6177","7.268230","160.36.131.221","192.168.0.137","TCP","1514","80  >  63590 [ACK] Seq=318281 Ack=521 Win=15744 Len=1460 [TCP segment of a reassembled PDU]"
"6178","7.268302","192.168.0.137","160.36.131.221","TCP","54","63590  >  80 [ACK] Seq=521 Ack=319741 Win=131328 Len=0"
"6179","7.269389","160.36.131.221","192.168.0.137","TCP","1514","80  >  63590 [ACK] Seq=319741 Ack=521 Win=15744 Len=1460 [TCP segment of a reassembled PDU]"
"6180","7.269415","192.168.0.137","160.36.131.221","TCP","54","63590  >  80 [ACK] Seq=521 Ack=321201 Win=131328 Len=0"
"6181","7.275068","160.36.131.221","192.168.0.137","TCP","1514","80  >  63590 [ACK] Seq=321201 Ack=521 Win=15744 Len=1460 [TCP segment of a reassembled PDU]"
